date,entity,title,sentiment_score
2025-12-18,AMZN,American Clean Power Association Withdraws Support For Speed Act After House Committee Amendment,-0.7286876965879003
2025-12-18,AMZN,Justice Department Files Lawsuit Against Georgia Voter Rolls,-0.27382162412434496
2025-12-18,AMZN,Media State Confrontation Over Bbc Draws Global Attention,-0.938739009618015
2025-12-18,AMZN,Area Hyundai Dealership Responds Theft Lawsuit Settlement,-0.28684388770179337
2025-12-18,AMZN,Climate Change Lawsuit,0.7586198375698585
2025-12-18,AMZN,Client Alert Trump Administration Issues Executive Order In Attempt To Preempt State Ai Laws,-0.734728644387084
2025-12-18,AMZN,Michigan Lawmakers Consider Repealing Red Flag Gun Laws,-0.10063488518307406
2025-12-18,AMZN,Australian Unions Condemn Bondi Beach Terror Attack As Politicians Vow Tighter Gun Laws,0.6934203105796584
2025-12-18,AMZN,Sc Ag Alan Wilson Meta Weight Loss Ai Content Body Image Lawsuit Funding States South Carolina Social Media Laws,-0.8012195468044441
2025-12-18,AMZN,Texas Just Put Smart Tv Privacy Lawsuit On Trial And It Could Affect Your Home,0.7747575962450683
2025-12-18,AMZN,Wisconsin Joins Lawsuit Against Uber Over Subscription Practices,-0.795358204245755
2025-12-18,AMZN,Dozens Workers Join Lawsuit Against .Html,-0.14746068656551725
2025-12-18,AMZN,Years Ago One Of The Biggest Hollywood Remakes Ever Caused A Lawsuit Still Complicating Movies Today,0.6114746690288264
2025-12-18,AMZN,New Police Service Dogs Pawsitively Proud To Serve Lower Mainland,0.3248291252635278
2025-12-18,AMZN,Janes Addiction Part Ways After Year Of Lawsuits,0.8193180044459489
2025-12-18,AMZN,New Laws Measures Canada Jan,-0.6894751795120502
2025-12-18,AMZN,What Would Concealed Carry Reciprocity Mean For States With Tighter Gun Laws,-0.4469256963362034
2025-12-18,AMZN,Marijuana Laws And The Workplace What Employers Must Know,0.3929003727408864
2025-12-18,AMZN,Red Hat Openshift Service On Aws,0.9368811418827889
2025-12-18,AMZN,Mev Trading Returns Court Pump Fun Class Action Lawsuit,-0.8306324623784429
2025-12-18,AMZN,Aclu Nevada Files Intervene Doj Lawsuit,0.43668135139440345
2025-12-18,AMZN,Australia To Introduce Stricter Hate Laws Affecting Visa Status After Bondi Beach Attack,-0.49401558382389776
2025-12-18,AMZN,Gambler Casino Lawsuit Drugged Vegas Aria Las Sue Sued Sues Incapacitated Intoxicated Drunk Drugs Drug Blackjack Poker Gambling Money Loan Marker Took Out Arrest Arrested Pay Paid Repay Repaid Defense Trial Court,0.5201601210058024
2025-12-18,AMZN,Idaho Lawsuit Challenges Commercial Marina Luxury Housing On Trestle Creek,0.4235157502677309
2025-12-18,AMZN,"What Would Lsquoconcealed Carry Reciprocityrsquo Mean For States With Tighter Gun Laws,",-0.9972793380619922
2025-12-18,AMZN,Australia To Review Migration Laws After Bondi Beach Shooting,0.2507806129068664
2025-12-18,AMZN,Berger Montague Investor Reminder Berger Montague Notifies Telix Pharmaceuticals Ltd Tlx Investors Of A Class Action Lawsuit And Deadline .Htm,-0.15075981051492326
2025-12-18,AMZN,B Covid Lawsuit China Takes Aim At Missouri Senator,0.7113222127423904
2025-12-18,AMZN,Julian Assange Sweden Broke Own Laws With Nobel Prize To Venezuelas Machado,0.948531703946252
2025-12-18,AMZN,Australia Anti Hate Laws Bondi Beach Albanese .,-0.9772552244574433
2025-12-18,AMZN,What Changes Are Planned To Australias Hate Speech Laws And How Will They Work Ntwnfb,0.672983351954139
2025-12-18,AMZN,Insp Lawsuit Inspire Medical Systems Inc Sued For Securities Fraud R.Htm,0.4606922077603499
2025-12-18,AMZN,Reps Set Up Panel To Probe Alleged Tampering In Gazetted Tax Laws,-0.6573476480053775
2025-12-18,AMZN,Sean Diddy Combs Set For Depo In Ongoing Civil Lawsuit,0.38141539744670183
2025-12-18,AMZN,Australian Pm Announces Tougher Hate Speech Laws After Bondi Beach Shooting That Killed  .Html,-0.8018616734583706
2025-12-18,AMZN,Centre To Introduce Securities Markets Code Bill To Replace Three Regulation Laws,0.4410805560171911
2025-12-18,AMZN,Australia Pushes Tougher Hate Speech Laws After Bondi Beach Shooting,0.5650108725667
2025-12-18,AMZN,Ai Executive Order Targets State Laws,0.017708707826668224
2025-12-18,AMZN,White Stadium Lawsuit Appeal Sjc,-0.5310601364372023
2025-12-18,AMZN,Feds Target Alleged East Harlem Drug Dealers Saying They Can Circumvent Nys Bail Laws,0.01078768280971576
2025-12-18,AMZN,A Huge Shock Is Coming For European Banks Russia Hands Out Lawsuits Over Russian Assets,-0.4724253458643861
2025-12-18,AMZN,Pa Legislature Nears A Decade Low In Laws Passed,-0.22580757518809258
2025-12-18,AMZN,Lucasfilm Wins Bid To Throw Out Uk Lawsuit Over Resurrection Of Star Wars Character Ceddcddfe,0.4461614468510471
2025-12-18,AMZN,Article Crown Withdraws Murder Charge Against Timothy Rees,0.7527817738200102
2025-12-18,AMZN,Australia Tighten Hate Speech Laws Bondi Massacre Mrufll,0.974522460233255
2025-12-18,AMZN,The Little Lawsuits That Cant,0.17757032580711285
2025-12-18,AMZN,Secrecy Surrounding Adams Adviser Randy Mastros Work For Madison Square Garden Flouted Ethics Laws,-0.9458210559629929
2025-12-18,AMZN,Kenyan Environmentalist Seeks To Drop Lawsuit Against Ritz Carlton Safari Lodge In Maasai Mara,-0.11858114387498242
2025-12-18,AMZN,Cik Launches Five Day Capacity Building Programme On Cybersecurity New Criminal Laws,-0.16965186732634874
2025-12-18,AMZN,Ottawa County Settles Lawsuit With Former Commissioner For .Html,0.5652389026494695
2025-12-18,AMZN,Gop Sen Schmitt On Lawsuit I Wont Be Apologizing To China,-0.294896420539674
2025-12-18,AMZN,Oklahoma Attorney General Joins Lawsuit Against Uber Alleging Deceptive Practices,0.2661849457338501
2025-12-18,AMZN,School Withdraws Appeal For Toilet Rolls From Pupils But Funding Strains Remain,0.8156029663668531
2025-12-18,AMZN,New Important Illinois Laws,-0.08911411148109405
2025-12-18,AMZN,Japan Faces Lawsuit Unconstitutional Climate Inaction Crisis Heat,-0.2884401804216934
2025-12-18,AMZN,Im Just A Person Who Lives In Tennessee Shrinian Discusses Lawsuit In First Public Interview,0.4332146304171176
2025-12-18,AMZN,Pepsico And Walmart Face Lawsuit Over Decade Long Pricing Claims,-0.06318703706128126
2025-12-18,AMZN,See How The Detroit District Spent  Million In Literacy Lawsuit Funds,0.6835256759224164
2025-12-18,AMZN,Albanese Hate Speech Laws Australia Bondi Beach B.Html,-0.08177748815264585
2025-12-18,AMZN,Texas Laws Taking Effect January,-0.9406818786215276
2025-12-18,AMZN,Jhx Lawsuit James Hardie Industries Plc Sued For Securities Fraud R.Htm,0.6890366781314166
2025-12-18,AMZN,Case Now Closed In Lawsuit Filed By.Aspx,0.40978750807785524
2025-12-18,AMZN,Shariah Council Demands Probe Of Discrepancies In Tax Laws,0.6874379495349936
2025-12-18,AMZN,Hackers Exploit Stolen Aws Iam Credentials For Ec Crypto Mining,0.9499301860068106
2025-12-18,AMZN,Lawsoc President Dinesh Singh Dhillon Not Elected Members,-0.8313269026874139
2025-12-18,AMZN,Cisco Sonicwall Disclose New Attacks Exploiting Zero Day Flaws,-0.7041510685706027
2025-12-18,AMZN,Closing Arguments Made In Lawsuit Between Iowa And Former Operator Of Honey Creek Resort,0.962458516859497
2025-12-18,AMZN,Tencent Horizon Zero Dawn Clone Canceled Sony Lawsuit,-0.37915203236003836
2025-12-18,AMZN,.Bingo Addict Stole K Cawston Garage Owned Brother,-0.20441001187774166
2025-12-18,AMZN,Lok Sabha Nod To Bill For Repealing Laws Welcome Step Amendments Happening Since Constitutions Inception Says Ex Law Secretary P K Malhotra,-0.5527318895694762
2025-12-18,AMZN,January   Deadline Join Class Action Lawsuit Against Stride R.Htm,0.35727390920385127
2025-12-18,AMZN,Overbrook Management Corp Cuts Stake In Amazon Com Inc Amzn.Html,-0.8055106467679019
2025-12-18,AMZN,Lawsuit Alleges Sexual Abuse Nc Youth Psychiatric Facility,-0.7101500707751938
2025-12-18,AMZN,W Penn Comments On Lawsuits,0.2028542912636484
2025-12-18,AMZN,Uber And Doordash Just Filed A Bizarre Federal Lawsuit Against Nyc Claiming They Are Being Forced To Do Something That Would Destroy Their Business,0.05818938993654732
2025-12-18,AMZN,Judge Rules In Favor Of Fraternity Members In Riley Strain Lawsuit,0.722652173675451
2025-12-18,AMZN,Kazakhstan Draft Morality Laws Threaten Rights,0.503802227194196
2025-12-18,AMZN,Sea World Crash Survivors Prepare For Injury Lawsuits C,0.140636189783385
2025-12-18,AMZN,Lawyers Face Scrutiny Over Fake Quotes In Patent Lawsuit,0.9937055537250907
2025-12-18,AMZN,China Sues Sen Schmitt And Others For Defamation Over Covid  Lawsuit,0.21698296022900032
2025-12-18,AMZN,Mourners Grieve  Year Old Killed In Bondi Mass Shooting As Australian Leader Pledges New Hate Laws,-0.7265281629413365
2025-12-18,AMZN,John Hayes Draws Made For  County Championships But Who Will Emerge To Shake Up The Big Three,-0.5295112384022356
2025-12-18,AMZN,Sourav Ganguly Files Rs  Crore Lawsuit Over Lionel Messi Kolkata Event Chaos Heres Who He Is Angry With Article,-0.9708846633844153
2025-12-18,AMZN,Saws Warns Festive Season Storms La Ni%C%B Conditions,-0.6921165120299042
2025-12-18,AMZN,Dc Plane Helicopter Crash Lawsuit Us,-0.5488305489159271
2025-12-18,AMZN,Walmarts   Starting Pay Draws Women To Trucking Amid Industry Shortage,0.21849294751239023
2025-12-18,AMZN,"Judge Issues Ruling On Parts Of Running Iron Ranch Lawsuit,",-0.0373347580950647
2025-12-18,AMZN,Commvault Named Aws European Sovereign Cloud Launch Partner .Html,0.7393916263702818
2025-12-18,AMZN,John Travolta Has A Child By Elvis Granddaughter Riley Keough Shocking Lawsuit Claims,0.32970900158346717
2025-12-18,AMZN,Coalition Urges Swift Laws Against Antisemitism,0.5424548214065434
2025-12-18,AMZN,Ls Group Withdraws As University Of Iowa Lobbyist Citing Conflict Of Interest,0.7338256957904556
2025-12-18,AMZN,Oracle Orcl Stock Falls Blue Owl Withdraws Michigan Ai Data Center,-0.19965862951815638
2025-12-18,AMZN,Red Hat Openshift Service On Aws Govcloud Achieves Fedramp High Authorization For Hosted Control Planes,-0.136021022718394
2025-12-18,AMZN,Ellen Degeneres Lawsuit Car Crash.Html,0.18544221351647994
2025-12-18,AMZN,Lawsuit Naming Maui Police Chief Famous Rapper Sex Crimes Case Dismissed,0.6245860615120649
2025-12-18,AMZN,Ellison Announces Menards Lawsuit Settlement In Minnesota,0.06596541731431782
2025-12-18,AMZN,Dawson Creek Star Seen Ahead Of Today Interview About Stage  Cancer Fight.Html,0.3835653172139648
2025-12-18,AMZN,John Travoltas Son Allegedly Riley Keough Biological Son Lawsuit Claims,-0.9664966668879926
2025-12-18,AMZN,Australia Vows New Hate Laws As Youngest Bondi Beach Shooting Victim Laid To Rest,-0.3100976827817785
2025-12-18,AMZN,Pakistan Withdraws From Two Major Squash Tournaments,0.38574535377438157
2025-12-18,AMZN,New Laws Modernize Workplace For St Century,0.20899230204468866
2025-12-18,AMZN,Trump Soon To File Massive Lawsuit Against Bbc,0.6698014937746668
2025-12-18,AMZN,Saudi Rental Penalties And Laws,-0.05099300860191058
2025-12-18,AMZN,Doj South Carolina Settle Lawsuit Claiming State Violated Americans With Disabilities Act,0.833091425179205
2025-12-18,AMZN,Hidden Homelessness And Its Implications For Laws And Policies Aimed At People Sleeping Outdoors,0.5380905722635905
2025-12-18,AMZN,Jeffrey Epstein Files Billionaires Dinner Elon Musk Jeff Bezos Sergey Brin.Html,0.6795687045514263
2025-12-18,AMZN,Are Lawsuit Alexandria Real Estate Equities Inc Sued For Securities R.Htm,-0.03250531349947772
2025-12-18,AMZN,Jefferson Health Meta Pixel Lawsuit Cookies Tracking .Html,-0.8153611428889183
2025-12-18,AMZN,Ellen Degeneres Faces New Trouble In  California Crash Lawsuit,0.4056721707602684
2025-12-18,AMZN,Our View Make South Carolina Safer In  With Two Much Needed Gun Reform Laws,-0.4950465942315656
2025-12-18,AMZN,Drummond Files Lawsuit Against Uber For Deceptive Practices,-0.9802710299181694
2025-12-18,AMZN,Mvp Boost Project Draws Opposition And Support As Deadline Nears To Comment To Ferc,-0.16490424575085272
2025-12-18,AMZN,Virgin Island Officials Mostly Mum About Doj Suing Over Gun Laws N,0.9873332264317902
2025-12-18,AMZN,When Interest Turned Rs  Lakh Loan Into Rs  Lakh A Farmer Sold His Kidney Usury Laws Explained Ws Kl .Html,0.817876799191646
2025-12-18,AMZN,Are There Negative Consequences For State Preemption Laws Indiana Group Wants Lawmakers To Take A Closer Look,0.34870577340039355
2025-12-18,AMZN,Arizona And National Republican Parties File Lawsuit To Stop No Labels From Changing Its Name To Arizona Independent Party,0.44083968474808155
2025-12-18,AMZN,Alabama Ag Steve Marshall Joins Lawsuit Against Ubers Subscription Trap Tactics,0.8459184163396154
2025-12-18,AMZN,Islamic Council Raises Alarm Over Secret Alterations Nigerias Gazetted Tax Laws,-0.8695456057428619
2025-12-18,AMZN,Securities Lawsuit Alert Inspire Medical Systems Inc Insp Contact R.Htm,0.5843877847470127
2025-12-18,AMZN,Doj Targets Georgia In New Voter Registration Lawsuit Tennessee Moves Toward Compliance,-0.32906616940728983
2025-12-18,AMZN,Factcheck Trumps Primetime Speech Draws Severe Criticism Blatant Lies .Html,-0.8106041289771222
2025-12-18,AMZN,Reps Probe Discrepancies In Gazetted Tax Laws Set Up Seven Member Committee.Html,0.3426957000350306
2025-12-18,AMZN,Ohio Supreme Court Justice Defends Past Prosecution Dropped Murder Case Rhoda Nathan Blue Ash Murdered Killed Convicted Elwood Jones Released Charges Dropped Withheld Evidence Mistrial Wlw Bill Cunningham Lawsuits Cincinnati,-0.31167395261657926
2025-12-18,AMZN,Securities Lawsuit Alert Blue Owl Capital Inc Owl Investors Contact R.Htm,-0.9564594597646938
2025-12-18,AMZN,Chinese Traditional Clothing Sold As Hanbok On Amazon Draws Controversy,0.2925691099758745
2025-12-18,AMZN,January   Deadline Join Class Action Lawsuit Against Carmax R.Htm,-0.16256612163433592
2025-12-18,AMZN,Tyra Banks Smize And Dream Hot Ice Cream Shop Lawsuit Washington Dc Louis Martin Christopher Powell Washington Dc Sydney Australia Eastern Market Building,-0.222451165022594
2025-12-18,AMZN,Ice Escalates Detainer Battles In Oregon As Sanctuary Laws Block The Agency From Holding Criminal Immigrants,-0.12931763837949584
2025-12-18,AMZN,Judge Orders Mediation And Cuts Parts Of Ursuline Hazing Lawsuit,-0.38549727683237256
2025-12-18,AMZN,President Trump Unveils Ai Eo Advancing Federal Preemption Of State Laws,0.27860928112727623
2025-12-18,AMZN,Australia Announces Tougher Hate Speech Laws In Wake Of Bondi Terrorist Attack .Html,-0.8646966717777858
2025-12-18,AMZN,Np Wage Discrimination Lawsuit,-0.08518047154418862
2025-12-18,AMZN,Riley Keough Allegedly Biological Mother John Travoltas Youngest Son Lawsuit,-0.7403799642182625
2025-12-18,AMZN,Protecting Children From Porn Attorney General Todd Rokita Files Lawsuit Against Websites Allegedly Violating Age Verification Law,-0.6146487394086029
2025-12-18,AMZN,Jeanie Beeman Chico Target Worker Berated Over Freedom T Shirt Draws K Donations,-0.46382014555528217
2025-12-18,AMZN,Elvis Granddaughter Is Biological Mother Of Travoltas Son Lawsuit,0.32883281768288786
2025-12-18,AMZN,District Air Crash Lawsuit T,0.4168804721386288
2025-12-18,AMZN,Judge Signs Off On Final Settlement In Bcbst Covid Vaccine Mandate Lawsuit In Chattanooga,-0.4397690978671873
2025-12-18,AMZN,Securities Lawsuit Alert Stride Inc Lrn Contact Levi Korsinsky R.Htm,0.5864360251048917
2025-12-18,AMZN,Airbnb Hosts Consider Class Action Lawsuit Over Hurricane Citys New Regulations,-0.5110330107910785
2025-12-18,AMZN,Jhx Deadline Jhx Investors Have Opportunity To Lead James Hardie Industries Plc Securities Fraud Lawsuit .Html,0.3578890517863058
2025-12-18,AMZN,Panama President Mulino Criticizes Judges Laws Need To Be Enforced Strictly,-0.7883754269591787
2025-12-18,AMZN,Lucasfilm Wins Bid To Throw Out Uk Lawsuit Over Resurrection Of Star Wars Character .Html,0.8340186031951924
2025-12-18,AMZN,Explained The Lawsuit Claiming Riley Keough Is Biological Mother To John Travoltas Son,0.2850514697761739
2025-12-18,AMZN,M Police Still Present As Armed Group Withdraws From Dr Congo City,-0.1687816337482868
2025-12-18,AMZN,Class Action Lawsuit Filed Against Stubhub Holdings Inc Stub R.Htm,0.2437313434790358
2025-12-18,AMZN,Judgy Mums Laws Sparks Christmas,-0.425626327119379
2025-12-18,AMZN,Summary Of Sb  Overriding Local Zoning Laws For Transit Oriented Housing Development,-0.25558957510811986
2025-12-18,AMZN,Jagatsinghpur Woman Dies After Daughter In Laws Attack,0.766073056218735
2025-12-18,AMZN,Iconic S Rock Band Janes Addiction Break Explosive Onstage Fight Million Lawsuit.Html,-0.979971388187272
2025-12-18,AMZN,Australia Announces Tougher Hate Speech Laws Following Bondi Massacre,-0.05688762789944812
2025-12-18,AMZN,Teachers Family Knew Of Sexual Abuse Of Student At Nj High School Lawsuit Claims.Html,-0.6293562859386863
2025-12-18,AMZN,Pdp Demands Six Month Extension Of Tax Laws Implementation To Allow Reps Probe Discrepancies,-0.6705113639020144
2025-12-18,AMZN,Paws Of War Reunites Soldier Battling Cancer With Puppy He Rescued Overseas,0.9148090731870038
2025-12-18,AMZN,John Travolta Fathered Elvis Great Grandson With Riley Keough New Lawsuit Claims,0.394114245951112
2025-12-18,AMZN,Recent Changes To Surrogacy And Art Laws Celebrated,0.5427610252992088
2025-12-18,AMZN,London Fashion Week Draws In British Icons For Fw,0.4667572306092107
2025-12-18,AMZN,Analysts Reaffirm Buy Ratings On Amazon Com Inc Amzn With Price Targets Up To,0.48043007340344834
2025-12-18,AMZN,Australia Bondi Beach Shooting Matilda Funeral Albanese Isis Hate Laws Rcna,0.04413609900761939
2025-12-18,AMZN,Tennessee Charlie Kirk Meme Arrest Lawsuit,-0.491529871978998
2025-12-18,AMZN,New Laws Taking Effect In Tennessee On January,-0.3133197519590034
2025-12-18,AMZN,Man Files Civil Rights Lawsuit After Being Arrested Over A Meme,-0.35906316628867563
2025-12-18,AMZN,Druski Speaks Out Sexual Assault Lawsuit Dismissed,-0.6405187948977111
2025-12-18,AMZN,Los Angeles Judge Dismisses Sexual Assault Lawsuit Against Marilyn Manson Citing Statute Of Limitations,0.15471225914362519
2025-12-18,AMZN,Mercy Health Defends Actions In Warren Miscarriage Lawsuit,0.48988516052733444
2025-12-18,AMZN,New Year Laws January  Changes For Australian Businesses,0.7797721577137351
2025-12-18,AMZN,Couriers Push For Worker Status In Lawsuit Against Delivery Platform,0.7653107122035201
2025-12-18,AMZN,Lonoke County Family Joins Lawsuit Against Roblox Over Alleged Child Exploitation,0.04067701943072288
2025-12-18,AMZN,Jeff Bezos And Lauren Sanchez Bezos Are Awarding  Million To A Leader In Neurodiversity Education,-0.5942466136760991
2025-12-18,AMZN,Former Eastern Iowa Airport Server Cid Lawsuit Wages Cedar Rapids Restaurant Operator Ssp America Cid Tara Hill Linn County Tips Tipped Workers Salary,-0.6752461692354692
2025-12-18,AMZN,Bears Potential Move Indiana Draws Sharp Reactions From Both States,-0.2922440143174052
2025-12-18,AMZN,Minnesota Lawsuits Highlight Growing Fight Over Noncompetes,-0.7992192467287911
2025-12-18,AMZN,Donald Trump Epstein Cover Up Claims  Billion Bbc Lawsuit Distraction,0.3062215168409177
2025-12-18,AMZN,Frozen Lake Draws Visitors As Sleigh Season Opens In Eastern Turkiye,-0.514253183440375
2025-12-18,AMZN,Article Australia Antisemitism Hate Speech Laws Bondi Sydney Shooting Albanese,-0.3399039971622213
2025-12-18,AMZN,January   Deadline Join Class Action Lawsuit Against Defi Technologies R.Htm,0.28127350272662244
2025-12-18,TSLA,This Ruling Could Make Buying A New Scout As Easy As A Tesla,-0.6565999875194526
2025-12-18,TSLA,California Threatens Tesla With  Day Suspension Of Sales License For Deceptive Self Driving Claims,0.4424900688053257
2025-12-18,TSLA,Who Is Mustafa Suleyman Microsofts Ai Chief Showers Praises On Sam Altman Elon Musk As He Vows To Push Superintelligence,-0.08576999322316436
2025-12-18,TSLA,Rivian Ceo Midprice Ev Sales Tesla Not Healthy Market,-0.16637855977727956
2025-12-18,TSLA,California Threatens Temporary Ban On Tesla Sales Over Autopilot Claims,-0.630678657581573
2025-12-18,TSLA,Citizens Downplays Waymo Tesla Competition .Html,0.9678988191152773
2025-12-18,TSLA,Marketminute    Tech Titans Ascendant Nvidia And Tesla Spearhead Year End Market Surge,-0.8117797531837108
2025-12-18,TSLA,Infrastructure Giants Protest Echostar Spectrum Sale To Spacex,-0.48564005800395593
2025-12-18,TSLA,Citizens Downplays Waymo And Tesla Competition Pressure On Uber Technologies Inc Uber Asserts Market Perform Stance,-0.32663085929625235
2025-12-18,TSLA,Tesla Dreams Ford Slumps Ceddcdfbf,-0.4089762653908853
2025-12-18,TSLA,California Judge Threatens To Shut Down Tesla Sales And Production In The State N,-0.9690650944439319
2025-12-18,TSLA,Elon Musk Sydney Sweeney Creepy Commentary,-0.04374391932173127
2025-12-18,TSLA,Elon Musk Wealth Soared Past .Html,-0.8291953476051006
2025-12-18,TSLA,Teslas Stock Drives Record High .Html,-0.11574442643441296
2025-12-18,TSLA,Indianorigin Techie Judged For How He Drank Water At Xai Hackathon Joins Elon Musk S Company .Html,-0.6549477880112815
2025-12-18,TSLA,Meet Vineeth Sendilraj Indian Origin Techie Mocked At A Hackathon For Drinking Water Now Building Ai For Elon Musk,-0.07737653779642595
2025-12-18,TSLA,Elon Musk Sydney Sweeney Breasts.Html,-0.23464641724628188
2025-12-18,TSLA,Ten Years Ago Spacex Turned Tragedy Into Triumph With A Historic Rocket Landing,0.8965000216518744
2025-12-18,TSLA,Us Senate Confirms Billionaire Private Astronaut Elon Musk Ally Jared Isaacman As Donald Trumps New Nasa Chief,-0.27904682813530446
2025-12-18,TSLA,Tesla Dreams Ford Slumps Ceddcdfeff,-0.1828299850044992
2025-12-18,TSLA,Elon Musks Net Worth Soars Now More Than Double His Closest Rivals Tesla Stock Continues Surge,0.8086068049709765
2025-12-18,TSLA,California Judge Finds Teslas Autopilot Marketing Misleading Dmv Sets Compliance Deadline,0.21269243761386813
2025-12-18,TSLA,No Need Save Money Richest Man Earth Elon Musk Says Money Will Soon Become Irrelevant,-0.48150136956446854
2025-12-18,TSLA,Byd Reaches  Million Nev Production Milestone Surpassing Tesla And Volkswagen Cumulative Ev Production,-0.9059996309497891
2025-12-18,TSLA,Where Will Tesla Be In  Year,0.09403008080229158
2025-12-18,TSLA,Lawmakers Raise Concerns About Echostar Deals To Sell Wireless Spectrum To Att Spacex,0.7173964013746816
2025-12-18,TSLA,Teslas Musk Premium In Focus With Spacex Ipo On The Horizon,-0.9268591770003349
2025-12-18,TSLA,Spacex Ipo Could Largest Public .Html,-0.3384093817013565
2025-12-18,TSLA,Elon Musk Transgender Daughter Vivian,-0.8355541620679436
2025-12-18,TSLA,Airtel Africa Partners With Starlinks Spacex,-0.021794045700298303
2025-12-18,TSLA,California Threatens Tesla Day Suspension.Html,0.36614381071460755
2025-12-18,TSLA,Rivian Ceo On Self Driving Designing Ai Chips And Why Tesla Needs More Competition .Html,-0.01052044186794876
2025-12-18,TSLA,Tesla Can Surpass Waymo By,0.8162659554370504
2025-12-18,TSLA,Airtel Africa Partners With Spacex To Roll Out Starlink Direct To Cell,-0.001566793741038408
2025-12-18,TSLA,Billionaire Jared Isaacman An Elon Musk Ally Confirmed As Nasa Chief,0.41624914919157163
2025-12-18,TSLA,Tesla Cybertruck Owner Says His Truck Playing Important Role Identifying Brown University,-0.7673073545682374
2025-12-18,TSLA,Why Elon Musk Is Jealous Of Indias Upi And Why Its Terrifyingly Fragile,-0.2862517050023501
2025-12-18,TSLA,He Spent  Years At Spacex Now Hes Making History With Its Biggest Competitor,-0.5592836020004086
2025-12-18,TSLA,California Threatens Tesla  Day Suspension Sales License,-0.3893233610772353
2025-12-18,TSLA,Misrepresentations To The Public Teslas Facade Crumbles As Judge Orders Sales Suspended Because Weve Been Lied To,-0.5661087028976879
2025-12-18,TSLA,How New Nasa Chief Jared Isaacman Plans To Beat Biggest Rival China In Race To The Moon Trump Spacex Starship,0.2629154234348585
2025-12-18,TSLA,Why Tesla Stock Popped Thursday,-0.7518486433559664
2025-12-18,TSLA,This Chart Captures Teslas Ev Sales Woes And Things Are About To Get Worse,0.3363661042796886
2025-12-18,TSLA,Rep Gilbert Ray Cisneros Jr Buys Tesla Inc Nasdaqtsla Shares.Html,-0.7684169897205972
2025-12-18,TSLA,Teslas Ev Empire Worth Just  Per Share Analyst Warns Amid Robotaxi Hype,-0.9473958965824227
2025-12-18,TSLA,Elon Musk Says No Need To Save Money Claims There Will Be No Poverty In Future .Html,-0.7585358279715979
2025-12-18,TSLA,Elon Musk Ally Takes The Helm At Nasa As America Prepares To Return To The Moon,0.5843617804814858
2025-12-18,TSLA,Tesla Poor Sales In,-0.9691110282888813
2025-12-18,TSLA,Where Tesla  .Html,0.8025773185514851
2025-12-18,TSLA,California May Suspend Teslas Sales License Over Alleged Deceptive Self Driving Claims,0.5747954035944725
2025-12-18,TSLA,Tesla Owners Buy Emergency Escape Tools Amid Safety Concerns,-0.9978943771311182
2025-12-18,TSLA,Pickle Robot Adds Tesla Veteran As First Cfo,0.09894330674713236
2025-12-18,TSLA,A Spacex Starlink Satellite Is Tumbling And Falling Out Of Space After Partial Breakup In Orbit,0.5242408563148497
2025-12-18,TSLA,Elon Musk Calls Trump Accounts Nice Gesture But Says Ai Will Eliminate The Need To Save Money,0.5827765872330963
2025-12-18,TSLA,California Threatens Tesla With  Day Suspension,-0.9998453903844726
2025-12-18,TSLA,Tesla Faces Sales Ban In California Over Self Driving Claims,0.8060046279809401
2025-12-18,TSLA,Grant Private Wealth Management Inc Acquires New Holdings In Tesla Inc Tsla.Html,0.8311789358081048
2025-12-18,TSLA,Have A Tesla Want Normal Buttons Knobs,0.3338221419656895
2025-12-18,TSLA,Bernie Sanders Elon Musk Exchange Sharp Words Over Call For Ai Data Center Moratorium Theyre Cowards,0.2379732312747771
2025-12-18,TSLA,Tesla California Dmv Threat Ban Autopilot Marketing,0.9916710273088927
2025-12-18,TSLA,Tesla Engaged Deceptive Marketing Autopilot .Html,0.5081830760925767
2025-12-18,TSLA,Spacex Loses Contact Starlink Satellite After Mishap,-0.8009281876516539
2025-12-18,TSLA,California Might Ban Tesla Sales For  Days Over Deceptive Autopilot Marketing,0.24584669695074446
2025-12-18,TSLA,Cantor Fitzgerald Bullish Tesla Inc .Html,-0.8209538802709366
