date,entity,title,sentiment_score
2025-12-18,TSLA,Tesla Sales In California Expected To Continue Despite Autopilot Marketing Scrutiny,0.4078417628593016
2025-12-18,TSLA,Tesla Drivers Are Buying Escape Tools And Cars To Avoid Getting Trapped Inside,-0.756403082151534
2025-12-18,TSLA,Marketminute    The  Trillion Pivot How Autonomy And Ai Propelled Tesla To Record Highs,0.10977662960277246
2025-12-18,TSLA,Why Billionaire Elon Musk Thinks Saving Money Wont Matter In The Future Ws L .Html,0.4203016181811665
2025-12-18,TSLA,Elon Musk Faces Backlash Over Comments About Sydney Sweeneys Boobs,-0.27880106987729025
2025-12-18,TSLA,Elon Musks Comments Sydney Sweeneys Boobs Prove A Politcal Symbol,0.9816117525164649
2025-12-18,TSLA,Stockstory    Why Tesla Tsla Stock Is Trading Up Today,0.3569446655825719
2025-12-18,TSLA,Better Ev Stock Rivian Vs Tesla,0.3473278581355226
2025-12-18,TSLA,Jeffrey Epstein Files Billionaires Dinner Elon Musk Jeff Bezos Sergey Brin.Html,-0.7454679691396171
2025-12-18,TSLA,Airtel Spacex Partner On Starlink Mobile Connectivity,-0.8706595711573326
2025-12-18,TSLA,Kims Bengaluru Head Cardiologist Trashes Elon Musks Annual Preventive Mris Idea Astoundingly Absurd .Html,-0.5034348394461996
2025-12-18,TSLA,Tesla Sparks Outrage Sudden Move .Html,0.30247651629110694
2025-12-18,TSLA,Cantor Fitzgerald Bullish On Tesla Inc Tsla,0.129896701222441
2025-12-18,TSLA,Married To Medicine Dr Simone Son Jeep Tesla,-0.6913882157156364
2025-12-18,TSLA,Explosive Recording Elon Musk Trump .Html,0.9137498044519876
2025-12-18,TSLA,Chinas Mind Control Robot Tech Breakthrough Brings Elon Musks Telepathy Dream Life,-0.18229925216080933
2025-12-18,TSLA,Lawmakers Raise Concerns About Echostar Deals To Sell Wireless Spectrum To At T Spacex Ceddcdfcf,0.293719180513061
2025-12-18,TSLA,California Judge Rules Tesla Autopilot Marketing Deceptive Recommends Sales Ban,-0.8150513354770281
2025-12-18,TSLA,California Regulator Finds Tesla Misled Consumers On Driver Assistance Technology,0.7655620908178877
2025-12-18,TSLA,Tesla Stock More Doubled Fresh .Html,0.3562455725293343
2025-12-18,TSLA,Elon Musk No Poverty Dalio Philanthropy Saving Accounts Trump,-0.12093271706067621
2025-12-18,TSLA,Report Elon Musk Is Funding Republican Campaigns In  Midterms,0.8773884994917671
2025-12-18,MSFT,Microsofts Push For Copilot Plus Pcs Could Stall Laptop Sales,0.22327635958528158
2025-12-18,MSFT,How Microsoft Stock Can Increase  To,0.5484485719745147
2025-12-18,MSFT,Who Is Mustafa Suleyman Microsofts Ai Chief Showers Praises On Sam Altman Elon Musk As He Vows To Push Superintelligence,-0.5297645462885816
2025-12-18,MSFT,Is Microsoft Corporation Msft One Of Billionaire David Teppers Top Stock Picks Heading Into,0.4892758634153691
2025-12-18,MSFT,Invisible Material Could Make Windows Super Insulating,0.5998544537207606
2025-12-18,MSFT,Updated Police Arrest Nigerian Over Cyberattack Targeting Microsoft  Users,0.3890252962224807
2025-12-18,MSFT,Sandow Design Group Acquires Canadian Magazine Azure,-0.5051676154537244
2025-12-18,MSFT,Marketminute    Dow Jones Surges As Inflation Relief Ignites Year End Rally Goldman Sachs And Microsoft Lead The Charge,-0.5083241056534795
2025-12-18,MSFT,Prosperops Achieves Microsoft Azure Ip Co Sell Status,-0.34762486846496743
2025-12-18,MSFT,What Microsofts Nigeria Skills Programme Achieved,0.3361061153654652
2025-12-18,MSFT,Police Arrest Suspected Hackers Of Microsoft Database,0.6405455203290351
2025-12-18,MSFT,Take A Look At Some Of The Magical Advent Windows Adorning,-0.47780450634057514
2025-12-18,MSFT,Data Center Microsoft Rezoning Approval New Data Center Gaines Township Kent County Electricity Artificial Intelligence Patterson Avenue,0.6069316069158432
2025-12-18,MSFT,Microsoft Google Among  Firms Joining Us Ai Genesis Mission,0.8660881902287372
2025-12-18,MSFT,Reactshell Exploitation Spreads As Microsoft,-0.9034972442814977
2025-12-18,MSFT,Colorados Windy Wednesday Denver Airport Delays Crashes Broken Windows And Downed Power Lines Cbs News,0.3992753322358449
2025-12-18,MSFT,Lionglass Windows Windshields Development With Vitro Architectural Glass,-0.4130721610967165
2025-12-18,MSFT,Microsoft Looks Table Pounder Dipping .Html,0.01591256905749172
2025-12-18,MSFT,Ceo Ca Technologies Ltd Ceo Ca S Inside The Boardroom Nextechd Ai Gains Netflix Microsoft And Google As Clients For  .Htm,0.8517325750789699
2025-12-18,MSFT,Police Arrest Suspect Over Microsoft  Cyber Attack,-0.30321679557150083
2025-12-18,MSFT,Police Arrest Man Over Microsoft Cyberattack,0.926453168629171
2025-12-18,MSFT,Transparent And Insulating Aerogel Could Boost Energy Efficiency Of Windows,0.25081894105277347
2025-12-18,MSFT,Microsoft Copilot Ai Vision Pc Assistant Christmas Holiday Ad,-0.4378407347397
2025-12-18,MSFT,Microsoft Nasdaqmsft Stock Acquired Rep Gilbert Ray Cisneros Jr.Html,0.1683458307583563
2025-12-18,GOOGL,Uk Government Pushes For Nudity Blocking Systems On Apple And Google Devices,-0.5342748850399435
2025-12-18,GOOGL,The Oscars Are Going Full Youtube In,0.19302690356056096
2025-12-18,GOOGL,Oscars Telecast To Move From Abc To Youtube In,-0.18867571024446872
2025-12-18,GOOGL,The Oscars Are Moving To Youtube Beginning In,0.3653422234232504
2025-12-18,GOOGL,Ed Raids Unnao Youtuber Anurag Dwivedis Residence In Unnao Days After Lavish Dubai Wedding,-0.8116525150545475
2025-12-18,GOOGL,Hut  Ceo Says  Billion Data Center Deal With Google Is First Domino To Fall .Html,0.7468889622356791
2025-12-18,GOOGL,Who Is Anurag Dwivedi And Why Has Ed Raided Youtuber Residences In Uttar Pradesh Heres What You Need To Know As His Lamborghini Mercedes Are Seized,0.12457413414388063
2025-12-18,GOOGL,Most Popular Christmas Cookie This Year According To Google,-0.45076063356858165
2025-12-18,GOOGL,In Huge Broadcast Tv Blow Oscars Heading To Youtube,-0.24078108543576682
2025-12-18,GOOGL,Union Bancaire Privee Ubp Sa Sells  Shares Of Alphabet Inc Goog.Html,0.5213441667258312
2025-12-18,GOOGL,Cohesity Deepens Google Cloud Alliance For Across Anz,0.9618546450834147
2025-12-18,GOOGL,History Youtube Series Highlights Williamsburg Yorktown Ahead Of Countrys Th Birthday,-0.7456266778282978
2025-12-18,GOOGL,Youtube Hit Comedian Fluffy To Perform At  Clay County Fair,-0.13510292901425047
2025-12-18,GOOGL,Oscars Moving To Youtube,-0.3924533502538483
2025-12-18,GOOGL,Youtube Secures Exclusive Oscars Streaming Rights Starting,-0.19283821499028853
2025-12-18,GOOGL,Google To Build Three Subsea Cables In Papua New Guinea Under Australia Backed Defence Pact.Html,-0.3234776820946863
2025-12-18,GOOGL,Youtube Terminates Screen Culture Kh Studio Fake Ai Trailer,-0.23505900618875275
2025-12-18,GOOGL,Jackson Wealth Management Llc Has   Million Stock Holdings In Alphabet Inc Googl.Html,0.40239826068092754
2025-12-18,GOOGL,Oscars Youtube  Abc Broadcast B.Html,-0.16961164161967734
2025-12-18,GOOGL,Youtube Makes History By Winning Exclusive Rights To One Of Tvs Biggest Events That Hasnt Happened In Decades,-0.052185374198636225
2025-12-18,GOOGL,Oscars Academy Awards Youtube Move Explained,0.4042516821351485
2025-12-18,GOOGL,Oscars To Move From Broadcast Tv To Youtube In,0.10040687967431539
2025-12-18,GOOGL,Oscars On Youtube  Academy Leaves Abc Viewership Decline,0.5335474119060435
2025-12-18,GOOGL,Google Nvidias Vc Units Back Lovables M Funding Round At B Valuation,0.28387300995335796
2025-12-18,GOOGL,Insider Selling Alphabet Nasdaqgoogl Ceo Sells  Shares Of Stock.Html,-0.09727917277280129
2025-12-18,GOOGL,Telstra Satellite Messaging Expands To Include Google Pixel Devices.Html,-0.016345630947839362
2025-12-18,GOOGL,Release Of Gpt Image  Answers Googles Nano Banana Drop,-0.9901961717377394
2025-12-18,GOOGL,Google To Lead M Papua New Guinea Subsea Cable Scheme,0.7864990277903976
2025-12-18,GOOGL,Youtuber Anurag Dwivedi Betting Scam Case Ed Cracks Down Lamborghini Mercedes Seized From Unnao Home,0.7430064204035081
2025-12-18,GOOGL,Ed Raids Unnao Youtuber Anurag Dwivedi Seizes Luxury Cars In Online Betting Money Laundering Probe .Html,-0.5846883739523618
2025-12-18,GOOGL,Lamborghini Urus Bmw Z Seized As Ed Cracks Down On Youtuber Linked To Online Betting Ws L .Html,0.5938689550003986
2025-12-18,GOOGL,Oscars Stream Exclusively Youtube,0.5830109380287736
2025-12-18,GOOGL,Young Thug Proposal  Savage Gunna Thug Oscars Youtube Move,0.10155324340408667
2025-12-18,GOOGL,Jobs Bloodbath Coming In  As Google Changes Drive Publishers Toward Collapse,-0.42288468185240125
2025-12-18,GOOGL,Spittin Chiclets Leaving Youtube For Netflix,0.6225469267361541
2025-12-18,GOOGL,Sahyog Portal Modi Government Facebook Twitter Instagram Youtube Snapchat Social Media Platforms Karnataka High Court Ashwini Vaishnaw,-0.001607228084814727
2025-12-18,GOOGL,Td Cowen Raises Alphabet Googl .Html,-0.4401010405102215
2025-12-18,GOOGL,Alphabet Nasdaqgoogl Ceo Sundar Pichai Sells  Shares.Html,-0.4876094797516015
2025-12-18,GOOGL,Exclusive Google Makes Fresh Bn Cash Injection Into Uk Data Centre Subsidiary,-0.3976722427546857
2025-12-18,GOOGL,Google Tv Freeplay Adds Even More Free Streaming Channels Bringing Its Library Total To Over,0.8943864346710904
2025-12-18,GOOGL,Oscars To Stream Exclusively On Youtube Starting In,0.46189085212228576
2025-12-18,GOOGL,Google Maps Introduces Battery Saver Navigation Mode Step By Step Guide For Pixel  Series,-0.5178873620554676
2025-12-18,GOOGL,And The Oscars Go To Youtube The Academy Is Ditching Tv For Streaming,-0.3651247734819567
2025-12-18,GOOGL,How Misreading Google Trends Is Fuelling Bondi Attack Conspiracy Theories,0.6686657161993657
2025-12-18,GOOGL,Oscars To Switch From Broadcast Tv To Youtube From,0.4754595409327431
2025-12-18,GOOGL,Another Big Win Streaming Youtube Broadcast Oscars,-0.4389160988989358
2025-12-18,GOOGL,Amie Thuener Otoole Sells  Shares Of Alphabet Nasdaqgoog Stock.Html,0.3081211479513055
2025-12-18,GOOGL,Google Launches Preferred Source News .Html,-0.7541976209375916
2025-12-18,GOOGL,Oscars To Stream Free On Youtube Worldwide From  As Abc Run Ends,-0.32386459594378403
2025-12-18,GOOGL,The Oscars To Make The Move To Youtube Starting In,-0.4969299620356855
2025-12-18,GOOGL,Google Maps Revived Discontinued Feature Winter,0.6119539412045374
2025-12-18,GOOGL,Youtube Wins Exclusive Streaming Rights To The Oscars,0.4155929093831703
2025-12-18,GOOGL,Google Reveals  Critical Searches In Nigeria,-0.2126544836326021
2025-12-18,GOOGL,Insider Selling Alphabet Nasdaqgoogl Cao Sells  Shares Of Stock.Html,0.8621419831385
2025-12-18,GOOGL,Oscars Telecast To Move Off Broadcast Tv To Youtube In,0.11231831840407991
2025-12-18,GOOGL,Eu Threatens New Fine For Google Play Says Changes Dont Go Far Enough,0.8637158392736166
2025-12-18,GOOGL,And The Stream Goes To Oscars To Leave Abc For Youtube In,0.9579996945081626
2025-12-18,GOOGL,Oscars To Leave Us Network Abc For Youtube In,-0.15376072479629332
2025-12-18,GOOGL,Lamborghini Urus Mercedes Among Luxury Cars Found In Ed Raid On Up Youtuber,-0.8911705185271579
2025-12-18,GOOGL,Google News Audio Feature Reads Headlines Aloud With Gemini Ai,-0.09183827573422243
2025-12-18,GOOGL,Oscars Coming Exclusively Youtube  Officially Dropping Disneys Abc.Htm,-0.8934593387253382
2025-12-18,GOOGL,Malaysian Solar Plants To Supply Power For Googles Data Centres.Html,0.1048611420845118
2025-12-18,GOOGL,Looking For Meaning Ceasefire To Pookie  Words That Sent Indians To Google In .Html,0.6409873484447683
2025-12-18,GOOGL,Oscars Shift To Exclusive Youtube Streaming In  Leaving Abc,0.7123166303148312
2025-12-18,GOOGL,Academy Awards Move To Youtube Starting  Ending Decades Of Broadcast Television,-0.44605883774279875
2025-12-18,GOOGL,Oscars To Stream Exclusively On Youtube From  .Htm,0.20700490856413456
2025-12-18,GOOGL,From Vibe Coding To Faster Models Whats New In Googles Gemini Update,-0.6369217175078239
2025-12-18,GOOGL,Court Information Youtube Rahul Gandhi Defamatory Speech Savarkar,-0.9677288410531144
2025-12-18,GOOGL,Youtube Secures Exclusive Global Streaming Rights To The Oscars From  To,-0.18053960632598565
2025-12-18,GOOGL,Oscars Set To Leave Abc And Will Be Streamed Live On Youtube From,0.24697068273308842
2025-12-18,GOOGL,Youtube Playstation Top Downdetectors Largest Outages Of,0.4241079990708394
2025-12-18,GOOGL,Oscars To Stream For Free On Youtube From  After  Years Explained,-0.9327111867215745
2025-12-18,GOOGL,Misreading Google Trends Fueling Bondi.Html,0.17820986966285823
2025-12-18,GOOGL,Youtuber Gary Buechler Declares That Simply Believing In Yourself Is Nonsense When It Comes To Success In Memoir Waiting For Nerdrotic,-0.43821832427234253
2025-12-18,GOOGL,Spotify Linkedin Youtube Partiful Straval Recaps,0.7233871904819018
2025-12-18,GOOGL,Youtube To Become Exclusive Broadcaster Of The Oscars Starting In,0.9524622609813851
2025-12-18,GOOGL,Google Leverages Upi Network To Launch Digital Credit Card Flex Know What It Is And How It Works,0.19002625078349955
2025-12-18,GOOGL,Ed Searches  Locations In Up Linked To Youtuber In Online Betting Probe,0.4378490087799518
2025-12-18,GOOGL,Youtube Oscar Tv Neal Mohan Connor Storrie Heated Rivalry,0.991100952664038
2025-12-18,GOOGL,Mexico S Antitrust Commission Resolves Android Competition Case Orders Google To Drop Restrictions Ceddcdff,-0.2049325227802885
2025-12-18,GOOGL,Youtube Pulls Music Data From Billboard After Dispute Over Stream Weighting,0.4915170531086588
2025-12-18,GOOGL,Why Alphabet Googl Shares Falling .Html,0.8764553567470696
2025-12-18,GOOGL,Malaysia Totalenergies Signs New Renewable Power Agreement With Google To Supply Data Centers,-0.43322874874908246
2025-12-18,GOOGL,Nolte Failing Oscars Demoted To Youtube,-0.5155982106977799
2025-12-18,GOOGL,Google Scraps Unified Ad Pricing Amid Antitrust Pressure Boosting Publisher Revenues,0.07825542732896884
2025-12-18,GOOGL,Google Stocks  Billion Gift To Investors,0.7910352721971761
2025-12-18,GOOGL,Oscars Youtube Exclusive Event Starting,-0.8578456746659282
2025-12-18,GOOGL,Chatgpt Vs Perplexity Vs Google Gemini New Report Says This Is India S Favourite Ai Chatbot.Html,-0.8443497759441787
2025-12-18,GOOGL,Oscars Set To Stream Exclusively On Youtube Starting In,0.6975936160887304
2025-12-18,GOOGL,Mexico Antitrust Body Says Google Cannot Impose Use Of Android On Mobile Device Manufacturers Ceddcdfc,-0.9217954246206055
2025-12-18,GOOGL,Oscars Will Move To Youtube From Abc Starting In,0.046450292262341986
2025-12-18,GOOGL,Can Law Enforcement Access Google Search Data Without Warrant Pennsylvania Says Yes,-0.4604956229211652
2025-12-18,GOOGL,Nick Reiner Delivers Chilling Message In Resurfaced Youtube Vid,-0.9188240531762195
2025-12-18,GOOGL,Oscars To Ditch Broadcast Tv For Youtube In Deal Sending Shockwaves Through Hollywood,-0.8662849917053552
2025-12-18,GOOGL,Oscars Moving From Network Tv To Youtube,0.8423627083704295
2025-12-18,GOOGL,Hollywoods Biggest Night Goes Digital As Oscars Move To Youtube From,0.5437396303146966
2025-12-18,GOOGL,"The Academy Partners With Youtube For Exclusive Global Rights To The Oscars And Other Academy,",0.8582927325277043
2025-12-18,GOOGL,Palliative Care Clearing Up The Myths And Understanding The Support Available Scfgoogdzjghnnetzlzvzbcueq,0.2449576320782596
2025-12-18,GOOGL,Oscars To Stream Exclusively On Youtube From,0.6624124922906076
2025-12-18,GOOGL,Oscars Could Stream On Youtube Starting  What The New Deal Means .Html,-0.34669196967044225
2025-12-18,GOOGL,Oscars To Move Exclusively To Youtube From,0.4711849353303912
2025-12-18,GOOGL,Youtube Deal Oscars Analysis,-0.44182230364050645
2025-12-18,GOOGL,Oscars Confirm Change Ceremonies Youtube,-0.8507106219274971
2025-12-18,GOOGL,Googles Deal Means Energy Investors .Html,-0.26939995260606886
2025-12-18,GOOGL,Totalenergies To Power Googles Malaysia Data Centres With Twh Of Solar Energy,0.8759805655134678
2025-12-18,GOOGL,Oscars  Moving To Youtube,-0.31100417233486977
2025-12-18,GOOGL,Sanders Morris Harris Llc Has   Million Position In Alphabet Inc Goog.Html,-0.34143055755524365
2025-12-18,GOOGL,The Oscars Will Move To Youtube In  Leaving Longtime Home Of Abc,0.43532394493563675
2025-12-18,GOOGL,Google Launches Cc An Ai Assistant That Summarizes Your Day Every Morning In Gmail,0.799761070707657
2025-12-18,GOOGL,Alphabet Inc Googl Is New England Research Management Inc S Largest Position.Html,0.9965804321898937
2025-12-18,GOOGL,Oscars Make Sudden Jump From Abc To Youtube,0.3603979141981788
2025-12-18,GOOGL,Microsoft Google Among  Firms Joining Us Ai Genesis Mission,-0.5453648833838032
2025-12-18,GOOGL,Oscars To Abandon Broadcast Tv For Youtube From,0.6258082731381045
2025-12-18,GOOGL,Google Amazon And Meta Embed Ai Into Core Products,-0.6769662969501591
2025-12-18,GOOGL,Google Adds Location Targeting Controls To Demand Gen Campaigns,-0.980021001790697
2025-12-18,GOOGL,Google Youtube Eye The Growing  Mn Indian Micro Drama Pie,0.6427889093152113
2025-12-18,GOOGL,Youtube Snags A Streaming Exclusive That Could Change The Movie Industry Forever,0.5825285279124486
2025-12-18,GOOGL,Academy Youtube Partner Exclusive Global Rights Oscars,0.004800972683544291
2025-12-18,GOOGL,Oscars To Stream On Youtube For Free From,0.6143437234016209
2025-12-18,GOOGL,Academy Awards Telecast Moving From Abc To Youtube In,-0.36277356884598255
2025-12-18,GOOGL,Youtube Oscars Lifeline Viewership Streaming Tv,0.0610403962558399
2025-12-18,GOOGL,Google Ai Incorrect  Ev Tax Credit,0.8284701419650264
2025-12-18,GOOGL,Youtube Shuts Down  Major Channels Over Ai Created Fake Trailers,-0.9540505868510647
2025-12-18,GOOGL,University Develops Ai Training Groupd Googlecloud,0.4956589570418317
2025-12-18,GOOGL,Devin Nunes Trump Media Nuclear Fusion Google,0.9214425457927216
2025-12-18,GOOGL,Oscars Move To Youtube  Ceremony Will Be Last On Abc,-0.5202010244991271
2025-12-18,GOOGL,Dont Google Algorithm Decide What,0.6116447635605449
2025-12-18,GOOGL,Alphabet Googls Google Signs A Solar Power Agreement In Malaysia Reports Bloomberg,0.9239336207139848
2025-12-18,GOOGL,Googlebot Dominates  Web Crawling As Ai Bots Surge,0.15501296696317723
2025-12-18,GOOGL,Pacific News Minute Google Will Build Three Undersea Cables In Papua New Guinea,-0.6112883512439613
2025-12-18,GOOGL,Oscars Move To Youtube  Will Be Final Broadcast On Abc,0.1750235460824443
2025-12-18,GOOGL,Oscars Moving Youtube Academy Warns Tv Model Failing Viewers,0.996157109563707
2025-12-18,GOOGL,Rep Gilbert Ray Cisneros Jr Buys Alphabet Inc Nasdaqgoogl Stock.Html,0.08811429690616746
2025-12-18,GOOGL,Oscars Streaming Youtube Worldwide,-0.27357345727482785
2025-12-18,GOOGL,Google Search Preferred Sources Is Now Available In Canada,0.2762138473255997
2025-12-18,GOOGL,World Googled  Trends,-0.39281591924267745
2025-12-18,GOOGL,Shop The Most Googled Gift In New York Nintendo Switch,-0.08146555834352753
2025-12-18,GOOGL,The Oscars Set To Move To Youtube Starting In  Academy,-0.5442949072491745
2025-12-18,GOOGL,Youtube Music,0.5511336467962087
2025-12-18,GOOGL,Google Trends Misread Fuels Bondi Attack,-0.3072026655806954
2025-12-18,GOOGL,Oscars Youtube Deal Save Academy Awards,-0.33031890645520146
2025-12-18,GOOGL,With Freebies Openai Google Vie For Indian Users And Training Data .Htm,-0.8176912729969483
2025-12-18,GOOGL,Lamborghini Urus Mercedes Found At Up Youtubers House During Ed Raid,-0.17202601474756762
2025-12-18,GOOGL,M Google Investment To Expand Ai Robotics Programs At Houston City College,-0.08898927748613006
2025-12-18,GOOGL,With Freebies Openai Google Vie For Indian Users And Training Data,-0.3829823018468752
2025-12-18,GOOGL,Google Pay Rolls Out Flex A Upi Linked Digital Credit Card,-0.17540331111467644
2025-12-18,GOOGL,The Oscars To Leave Abc And Stream On Youtube Starting In,-0.8309581835105853
2025-12-18,GOOGL,Academy Awards Youtube,-0.9127202699204844
2025-12-18,GOOGL,Ceo Ca Technologies Ltd Ceo Ca S Inside The Boardroom Nextechd Ai Gains Netflix Microsoft And Google As Clients For  .Htm,0.9289023024522276
2025-12-18,GOOGL,Google Maps Brings Back A Feature It Killed In  Following Major Backlash,-0.028758655505568775
2025-12-18,GOOGL,Google Plans Return To The Pc Market With Aluminium Os Heres Why It Matters,-0.7657615286292125
2025-12-18,GOOGL,Aiscream J Pop Youtube,0.32650582686491014
2025-12-18,GOOGL,Oscars To Stream Live On Youtube Globally From  Ending Abcs Decades Long Run,0.9597174665995956
2025-12-18,GOOGL,The Oscars Are Leaving Abc And Heading To Youtube In,0.9698769171596384
2025-12-18,GOOGL,Hf Advisory Group Llc Cuts Position In Alphabet Inc Goog.Html,-0.36817493482828567
2025-12-18,GOOGL,Billboards Charts Are Increasingly Weighted Towards On Demand Streaming But Not Enough For Youtube .Html,0.28925609467173286
2025-12-18,GOOGL,Youtube Just Stole The Oscars From Abc And Its A Massive Change,-0.46638821987263146
2025-12-18,GOOGL,Body Found In Search For Missing Hiking Youtuber Who Disappeared,0.7881021051224046
2025-12-18,GOOGL,Fortnite Google Play Returns,-0.7518962680143984
2025-12-18,GOOGL,Alphabet Nasdaqgoog Ceo Sundar Pichai Sells  Shares.Html,0.481935299306105
2025-12-18,GOOGL,Allmedia Merzigo Facebook Midsomer Murders Peep Show Youtube,0.41513807794498514
2025-12-18,GOOGL,Oscars Move Youtube,0.6889384506421701
2025-12-18,GOOGL,Google Housecanary Idx Policy,0.45630932229612475
2025-12-18,GOOGL,Alphabet Inc Goog Is Union Bancaire Privee Ubp Sas Th Largest Position.Html,-0.38744158774824955
2025-12-18,GOOGL,Tech War Between Us Eu Ignites Spotify Danger After Google Apple Meta,0.16426775696442597
2025-12-18,GOOGL,Oscars Moving From Abc To Youtube Is A Good Thing,-0.17473182399197262
2025-12-18,GOOGL,Ceos And Celebrities Love Ouras Sleep Tracking Ring Its Ceo Has A Plan To Stay Ahead Of Apple And Google,0.009606406993386107
2025-12-18,GOOGL,Apple Google App Store Billing Choices Japan Msca.Html,-0.013112881456599501
2025-12-18,GOOGL,Oscars Telecast To Stream Live On Youtube In,0.46563132698685394
2025-12-18,GOOGL,Why Google Is Replacing Its Ai Model With Gemini  Flash,-0.2818935927643218
2025-12-20,AAPL,I Bought A Used Iphone  Mini And Learned A Hard Lesson,0.6639455632061269
2025-12-20,AAPL,Iphone Apples Smartphones Glitching Complaints.Html,-0.5634457182306871
2025-12-20,AAPL,Modified Udan Scheme To Connect North East By Helipads Smaller Airports,0.1594920307888723
2025-12-20,AAPL,. Best Chinese Takeaways London Based Tripadvisor,-0.008862473417753591
2025-12-20,AAPL,. Best Chinese Takeaways Berkshire Based Tripadvisor,-0.840617579027414
2025-12-20,AAPL,Apple Nasdaqaapl Shares Acquired Rep Gilbert Ray Cisneros Jr.Html,0.6258521348707591
2025-12-20,AAPL,New Oneplus Android Tablet Pad Go  Beats Apple Ipad Size Price Battery,-0.3557148562374388
2025-12-20,AAPL,Maine Warns People About Iphone Feature Causing  False Alarms,0.3958495120876864
2025-12-20,AAPL,Apples  Foldable Iphone Renders Leak A Slim Design And Bold New Pricing,-0.639649438856982
2025-12-20,AAPL,Iphone Fold Being Tested With Ultra Thin Flexible Glass To Achieve Crease Free Design,0.5910185488212074
2025-12-20,AAPL,. Best Chinese Takeaways Buckinghamshire Based Tripadvisor,-0.04400222809595711
2025-12-20,AAPL,Iphone  Pro Rumors Release Date Price Design Specs,0.14357856689662296
2025-12-20,AMZN,Trump Ballroom Lawsuit Chairman,-0.3412497276167308
2025-12-20,AMZN,Funeral Slain Bangladeshi Activist Draws Hundreds Thousands,-0.6109204112707298
2025-12-20,AMZN,Australia S Already Strict Gun Laws Under Lens After Sydney Killings,0.5502670933807972
2025-12-20,AMZN,Los Angeles Angels Settles Lawsuit With Family Of Pitcher Tyler Skaggs Over Fatal Overdose,-0.9596383615277917
2025-12-20,AMZN,Gauz Investors Have Opportunity To Lead Gauzy Ltd Securities Fraud Lawsuit Cedddefe,0.15222950935453605
2025-12-20,AMZN,State Withdraws Motion In Nd Beef Commission Lawsuit,0.4885435816551984
2025-12-20,AMZN,Drivers Told To Paws And Think Of Road Risk To Koalas,-0.2869146276206471
2025-12-20,AMZN,Tyra Banks Hit Lawsuit Sue Lease Disagreement,-0.40184237325247096
2025-12-20,AMZN,Bondi Attack New Laws Target Lawyered Up Hate Preachers As Minns And Albanese Support Royal Commission C,-0.1780685717955084
2025-12-20,AMZN,Nigeria Has Moved From Padded Budgets To Forged Laws Peter Obi,-0.03875304200411289
2025-12-20,AMZN,Usvi Stacey Plaskett Sues Duane Morris Over Epstein Linked Lawsuit Bills,0.8180310939387048
2025-12-20,AMZN,Florida B Lawsuit Starbucks Dei,-0.9791797980835233
2025-12-20,AMZN,Extremist Flag Laws Bondi Shooting,0.6847202512950317
2025-12-20,AMZN,Angels Settle Wrongful Death Lawsuit With Tyler Skaggs Family,0.1565606064797782
2025-12-20,AMZN,Nigella Lawson Love Life Explained,-0.4749262641685661
2025-12-20,AMZN,Weird Washington Laws,-0.5841504736631953
2025-12-20,AMZN,Florida Lawmakers Target Paper Straws Citing Health Regulation Concerns,0.9464848765624163
2025-12-20,AMZN,Cislac Condemns Discrepancies Between Tax Laws Passed National Assembly Assented Version,0.16336776844227252
2025-12-20,AMZN,Billionaires Are Betting Big On New Tech Topia Cities Where They Will Set The Laws,-0.14973566826349383
2025-12-20,AMZN,Bondi Attack Chris Minns Announces New Laws On Hate Symbols And Police Power To Remove Face Coverings C,0.6954496387293241
2025-12-20,AMZN,How Port Arthur Reshaped Australias Gun Laws,0.6403276500953194
2025-12-20,AMZN,Journalists Zero In On Certificate Of Need Laws And Turbulent Obamacare Enrollment Season,-0.031009576129168437
2025-12-20,AMZN,Pueblo Steel Mill Bnsf Lawsuit,-0.4506946438487287
2025-12-20,AMZN,Australian State Plans Tougher Laws Against Displaying Extremist Flags After Bondi Shooting,0.5150914054047806
2025-12-20,AMZN,Insp Deadline Insp Investors With Losses In Excess Of K Have Opportunity To Lead Inspire Medical Systems Inc Securities Fraud Lawsuit .Html,0.17273606979802625
2025-12-20,AMZN,New Laws Overhaul Ohios Property Tax System,-0.9153205059988438
2025-12-20,AMZN,Epstein Money Trail Lawsuits Claim Major Banks Enabled Jeffrey Epsteins Sex Trafficking Finances,-0.6137667375008766
2025-12-20,AMZN,New Maryland Laws Taking Effect New Years Day,0.9835498095622452
