date,entity,title,sentiment_score
2025-12-19,AAPL,Sanwo Olu Receives Mipads Most Influential Governor Award,-0.45192165263322237
2025-12-19,AAPL,Apple Weighs India For Iphone Chip Packaging Shift,0.7401346509939808
2025-12-19,AAPL,Iphone  Receives Massive Price Cut In New Sale Available For Rs   How To Buy,0.005590589121720724
2025-12-19,AAPL,Indias Defence Production Reaches All Time High In Fy Shripad Naik,0.6348278818258222
2025-12-19,AAPL,Apple Iphone  To Launch With Curved Display And Buttonless Design Heres What We Know.Html,0.9293886252033086
2025-12-19,AAPL,Chinmayi Sripada Gives A Hard Hitting Reply To Troll For Calling Her Husband Puppet If You Play Stupid Games You Will Get Stupid Results,0.17216520343459596
2025-12-19,AAPL,Airpods Live Translation English German Iphone Testing,-0.11392248552978246
2025-12-19,AAPL,Entries Called For Mami Select Filmed On Iphone,0.4593215617219577
2025-12-19,AAPL,Apple To Increase Iphone  Price In India Heres What We Know .Html,0.7079250886541959
2025-12-19,AAPL,Best Earbuds For Iphone  Our Top Picks For Sound Comfort Value,0.18675998096900592
2025-12-19,AAPL,Iphone Fold Cadbased Render Leaks Revealing Very Unusual Dimensions News .Php,0.5877760849988862
2025-12-19,AAPL,Apple News Headlines Iphone E Ios   Ios  Ipad Mini App Store Ads,0.11679502688735166
2025-12-19,AAPL,Apple Iphone Fold,-0.9376308308674473
2025-12-19,AAPL,Apple Simplifies Battery Replacement In M Macbook Pro For Easier Repairs,0.8746253692324919
2025-12-19,AAPL,Teen  Allegedly Uses Karambit Rob Victim Iphone And Ring Jurong West,-0.10212813002317911
2025-12-19,AAPL,Smallrig Expands Iphone  Pro Creative Potential With Full Professional Accessories,-0.8379086171399859
2025-12-19,AAPL,.Childhood Books Gave Us Escapism Ipads,0.3056777482170545
2025-12-19,AAPL,Mipad,0.4678058341805842
2025-12-19,AAPL,.Tripadvisors Best Pubs Ambleside Lake District,-0.30150977917315247
2025-12-19,AAPL,Israels Idf Bans Android Phones Do You Need To Buy An Iphone,-0.928272991472342
2025-12-19,AAPL,Why You Should Skip The Iphone Air Apples  Plan Leaks,-0.22124886906292507
2025-12-19,AAPL,House Help Buys Iphone  But Lives In Slum Reddit Post Debates What Rich Means .Html,0.7592428989184699
2025-12-19,AAPL,Tyler The Creator Surprises Hawthorne High Seniors With Ipads After Apple Music Honor,-0.21174120158221554
2025-12-19,AAPL,.Flavers Warrington Towns Top Rated Restaurant Tripadvisor,0.38583730148644335
2025-12-19,AAPL,Apple Cracks Open Japans Iphone Fortress Under Antitrust Fire,-0.49100629598965906
2025-12-19,AAPL,Ipad Gift Restores Vietnam Veterans Voice In Time For Christmas,0.6524448766901194
2025-12-19,AAPL,Apple Iphone Air Available With Rs  Discount On Amazon Check Deal Details.Html,-0.18304037976754373
2025-12-19,AAPL,Turn Ipad Into Laptop Replacement,0.7170415108855666
2025-12-19,AMZN,"Los Angeles Angels Settles Lawsuit With Family Of Late Pitcher Tyler Skaggs Over Fatal Overdose,",-0.7587793091288566
2025-12-19,AMZN,Scripps College Denied Move Of Students Lawsuit Trial From La To Pomona,-0.8137058662231367
2025-12-19,AMZN,Los Angeles Angels Settles Lawsuit With Family Of Late Pitcher Tyler Skaggs Over Fatal Overdose,0.1611463411417493
2025-12-19,AMZN,Securities Lawsuit Alert Inspire Medical Systems Inc Insp Contact R.Htm,0.8652046326337142
2025-12-19,AMZN,.Romsey Makers Christmas Market Draws Crowds,-0.2606303928901301
2025-12-19,AMZN,Council Clarifies Cat Laws After Michael Saga,-0.25162439462652486
2025-12-19,AMZN,James Hardie Industries Plc Jhx Shareholders Who Lost Money Have Opportunity To Lead Securities Fraud Lawsuit .Html,0.08968191757041644
2025-12-19,AMZN,San Patricio County Judge Rules In Taft City Managers Lawsuit,-0.579378427229438
2025-12-19,AMZN,Nascar Settles Antitrust Lawsuit With Racing Teams,-0.3521698244479845
2025-12-19,AMZN,Synopsys Inc Snps Shareholders Who Lost Money Have Opportunity To Lead Securities Fraud Lawsuit .Html,0.8015027684717568
2025-12-19,AMZN,Convicted Killer Draws Additional Prison Term For Gun Trafficking,-0.07347977865314248
2025-12-19,AMZN,Mysterious Shrine In Saigon Draws Pilgrims With Nameless Deity .Html,0.4780658456116311
2025-12-19,AMZN,Rfk Jr Backing Big Food S Drive Overturn Tough New State Laws,0.1075074587349687
2025-12-19,AMZN,Australia Toughens Hate Speech Laws After Bondi Beach Massacre,0.8966134029940549
2025-12-19,AMZN,Australian Leaders To Tighten Gun Laws After Bondi Massacre,0.23083711630393333
2025-12-19,AMZN,Epstein Money Trail Lawsuits Claim Major Banks Enabled Jeffrey Epsteins Sex Trafficking Finances,0.29481060652186497
2025-12-19,AMZN,Supreme Court Rejects Request To Stop Immigration Judges Lawsuit Merit Systems Protection Board National Association Of Immigration Judges Free Speech First Amendment,-0.91426456624776
2025-12-19,AMZN,Pipeline Developer Goes To Nd Supreme Court Seeking To Block Greenpeace Netherlands Lawsuit,0.8076486175047377
2025-12-19,AMZN,Michigan Joins Federal Lawsuit Accusing Uber Of Deceptive Practices Against Customers.Html,-0.20428814354261693
2025-12-19,AMZN,Adoption Day Post Showing Black Mother Holding White Baby Draws Racist Comments,0.18393098762075155
2025-12-19,AMZN,Australia S Already Strict Gun Laws Under Lens After Sydney Killings,0.4057424914504937
2025-12-19,AMZN,Rfk Jr Exacts Revenge On The Aap Claws Back Millions In Approved Hhs Grants,0.17922106746220456
2025-12-19,AMZN,Nagaland Lamhai Council Draws Red Line On Nh Project Cites Land Rights Killings,0.7414670998558814
2025-12-19,AMZN,Gun Laws Under Scrutiny After Bondi Incident,0.30997345770471685
2025-12-19,AMZN,Aws Deloitte Toyota Motor North Americas Shift Agentic Ai Awsreinvent,0.8519385407118298
2025-12-19,AMZN,After Bondi Beach Massacre Australia S Gun Laws Under Focus,0.04814252148315967
2025-12-19,AMZN,Proposed Gun Laws Threaten Farmers Livelihoods,0.1921726526799048
2025-12-19,AMZN,Cincinnati Zoo Highlights Endangered Species Act Impact Amid Legislative Changes Eagles Otters Animal Habitats Gray Wolf Laws Regulations,-0.5586498889819684
2025-12-19,AMZN,Menards Settles Multi State Lawsuit For   Million,0.7918313023735122
2025-12-19,AMZN,Wrongful Death Lawsuit Estate Alleges Therapist Sexually Abused Teen Patient Led Suicide,-0.11353864148033299
2025-12-19,AMZN,Nintendo Wii Controller Patent Lawsuit  Year Case,-0.674933501834249
2025-12-19,AMZN,Trump Admins Move Reclassify Marijuana Draws Praise And Pushback,-0.1012549554297677
2025-12-19,AMZN,Gwyneth Paltrow Draws Criticism From Kristin Cabot Over Coldplay Kiss Cam Scandal,-0.9576067970737925
2025-12-19,AMZN,Tennessee Ag Sues Roblox Says Platform Endangers Kids Breaches Consumer Laws,-0.6487483094957216
2025-12-19,AMZN,Cabarrus County Nc Public Comment Lawsuit Settlement,-0.16153437020944206
2025-12-19,AMZN,Texas Airbnb Lawsuit Toxic Mold B.Html,0.9877346696289862
2025-12-19,AMZN,Los Angeles Angels Settles Lawsuit With Family Of Pitcher Tyler Skaggs Over Fatal Overdose,0.8780166163720429
2025-12-19,AMZN,Australia Tightens Hate Speech Laws After Beach Shooting,-0.976218346944592
2025-12-19,AMZN,Sale Of Nazi Memorabilia By Beachwood Auctions Draws Criticism,0.9264248957784695
2025-12-19,AMZN,Attention Fun Shareholders Securities Fraud Lawsuit Filed Against Six Flags Entertainment Corp Ceddddedf,0.6810233809377513
2025-12-19,AMZN,New Maryland Laws Taking Effect On January,0.8700069719296555
2025-12-19,AMZN,Class Action Lawsuit Alert Levi Korsinsky Reminds Skye Bioscience R.Htm,-0.16992476477416485
2025-12-19,AMZN,Justice Department Files Lawsuit Against Georgia Voter Rolls,0.3243711983400466
2025-12-19,AMZN,Ut Professor Suspended Over Charlie Kirk Comment Wont Return Classroom During Lawsuit Court Rules,-0.23233702197639872
2025-12-19,AMZN,Lawsuit Accusing Apple Of Overcharging For App Store Apps Could Be Revived,-0.42645012625498935
2025-12-19,AMZN,Hate Speech Laws Pushed To Limit To Curb Anti Semitism,0.312621246263987
2025-12-19,AMZN,How The Shanti Bill Redraws Nuclear Safety Security And Liability Rules .Html,0.434516336519849
2025-12-19,AMZN,Google Scraper Lawsuit Serpapi,-0.621741861749495
2025-12-19,AMZN,Cliffhanger Reboot Sylvester Stallone Exit Reason Lawsuit,0.7544642491747897
2025-12-19,AMZN,Bnb Chain Amazon Aws Payment Integration Bnp,0.048660954461412054
2025-12-19,AMZN,Texas Schools Parental Rights Sb  Lawsuit,-0.23876839391296567
2025-12-19,AMZN,Democrats Threaten Lawsuit Justice Department Epstein Files Deadline,0.2358183042240114
2025-12-19,AMZN,Aviciis Manager Lawsuit Netflix Doc,-0.7631579949412346
2025-12-19,AMZN,Visa Mastercard Atm Fees Lawsuit Settlement,0.35392504143519865
2025-12-19,AMZN,Federal Judge Dismisses K Lawsuit Against Autozone,0.48506148321257103
2025-12-19,AMZN,Hyperscale Data Centers Hit   With Aws Google Microsoft Leading Global Boom,0.5152157021881276
2025-12-19,AMZN,Bay City State Theatre Bankruptcy Lawsuit Reaches Settlement,0.012572528482513334
2025-12-19,AMZN,Lashkar Overground Worker Seeks Bail For Mother In Laws Funeral High Court Says No Ground For Release,-0.14556379738990222
2025-12-19,AMZN,Securities Lawsuit Alert Perrigo Company Plc Prgo Investors Contact R.Htm,-0.5096173130607162
2025-12-19,AMZN,Proposed Kentucky Power Rate Increase Draws Opposition Public Hearing,-0.5167298951407444
2025-12-19,AMZN,Trump Admin Announces Crackdown Against Transgender Care To Minors Draws Flak From Medical Community,0.7080350939274056
2025-12-19,AMZN,H B Visa Fee Draws Third Court Challenge,-0.36896733429840434
2025-12-19,AMZN,China Sues Sen Schmitt And Others Defamation Over Covid  Lawsuit,0.41724242656245725
2025-12-19,AMZN,Pet Debt Court Civil Lawsuit Payment Plan Veterinary Insurance,-0.9186133689871281
2025-12-19,AMZN,Max Verstappen Did Not Agree Red Bull Demoting Liam Lawson Second Car Choice,-0.4608861899455454
2025-12-19,AMZN,Lucasfilm Wins Bid To Throw Out Uk Lawsuit Over Resurrection Of Star Wars Character,0.5327022540590096
2025-12-19,AMZN,Angels Settle Wrongful Death Lawsuit With Tyler Skaggs Family,-0.06358769118289032
2025-12-19,AMZN,Waterfront Captiva Restaurants Lawsuit Claims .Html,-0.6578181425174447
2025-12-19,AMZN,Australia To Tighten Gun Laws After Bondi Massacre,0.9894534908933619
2025-12-19,AMZN,Eeoc Lawsuit Ada Asl Interpreter Amazon Dsp,0.8425930821784275
2025-12-19,AMZN,New Dawson Creek Hospital Gets Colourful Exterior To Complement City Logo,0.4486872516102609
2025-12-19,AMZN,Amazon Com Nasdaqamzn Shares Up   Heres Why.Html,-0.992117668647946
2025-12-19,AMZN,New Laws Holidays And Awards What Changes In Sweden In January,0.468569211698582
2025-12-19,AMZN,Fcx Investors Have Opportunity To Lead Freeport Mcmoran Inc Securities Fraud Lawsuit With The Schall Law Firm,0.4008293773723066
2025-12-19,AMZN,Men Letter Graphic Print Drawstring Long Sleeve B,0.928827972658975
2025-12-19,AMZN,New Lawsuit Takes Aim At,0.13206016679179555
2025-12-19,AMZN,Dozens Of Workers Join Lawsuit Against Traeger Grills As The Utah Company Makes A Major Pivot,-0.8294085089263663
2025-12-19,AMZN,Menards Rebate Lawsuit Settlement,0.20502853374351915
2025-12-19,AMZN,Odisha Investor Meet In Hyderabad Led By Cm Majhi Draws Rs  Crore Investment Intentions Jobs In Thousands,-0.04652353059078984
2025-12-19,AMZN,Letter To The Editor Trump Enforces Laws That Are On The Books,-0.9196710825139465
2025-12-19,AMZN,Gossip Gentlemens Club And Lounge Lawsuit Sex Trafficking Vkukwdgm,-0.9452426836713155
2025-12-19,AMZN,Mourners Grieve  Year Old Killed In Bondi Mass Shooting As Australian Leader Pledges New Hate Laws,0.6920503467034989
2025-12-19,AMZN,Massachusetts Idling Laws,-0.645235406000076
2025-12-19,AMZN,Cpkc Holiday Train Stop Draws Big Crowd Big Donations For Kamloops Food Bank,0.36478458367486777
2025-12-19,AMZN,Berger Montague Attention Fun Shareholders Securities Fraud Lawsuit Filed Against Six Flags Entertainment Corp .Htm,-0.4926659808358651
2025-12-19,AMZN,Lawsuit Against Maui Police Chief Dismissed,0.9925608437208835
2025-12-19,AMZN,Drinking Straws Targeted In Florida Bill,-0.7099134215736984
2025-12-19,AMZN,Princeton News Adpol Lawsuits University Post Cybersecurity Incident,0.954806471935089
2025-12-19,AMZN,Los Angeles Angels Tyler Skaggs Settlement Wrongful Death Lawsuit,0.89695006526633
2025-12-19,AMZN,Exclusive Democracy Forward Files Foia Lawsuit After Hhs Deadnames Rachel Levine,0.6874191995992898
2025-12-19,AMZN,Executive Overreach Or Innovation Savior Trumps December Surprise Takes Aim At State Ai Laws,-0.3437618370861719
2025-12-19,AMZN,Rcmp Outlines  Dawson Creek Crime Trends,-0.0278973018002997
2025-12-19,AMZN,Woman Exonerated After Two Decades In Prison Talks About Lawsuit Settlement,0.6265828656744219
2025-12-19,AMZN,Judge Tosses Trump Linked Lawsuit Targeting Chief Justice Roberts Dealing Setback To Trump Allies,-0.9326706880006759
2025-12-19,AMZN,South Dakota Receives Funds As Part Of Menards Lawsuit Settlement,-0.3924233364770642
2025-12-19,AMZN,Domestic Violence Survivor Advocates Hope  Will Be Year Missouris Divorce Laws Finally Change,-0.7180353828099297
2025-12-19,AMZN,Burlington School District Reaches K Settlement In Former Athletic Directors Lawsuit Alleging Gender Pay Discrimination,0.3848672089059064
2025-12-19,AMZN,Collecting Wild Plants For Food Medicine Is A Tradition For Many Minnesotans But Laws Are Unclear,0.7473808823968069
2025-12-19,AMZN,Angels Settle Lawsuit Overdose Death Pitcher Tyler Skaggs,0.28375067229849127
2025-12-19,AMZN,Proton Ceo Andy Yen Warns Of Switzerlands Path To Police State Via Data Laws,0.20571764536530734
2025-12-19,AMZN,Ciy Council Laws Worker Street Vendor Housing,0.1760453346440365
2025-12-19,AMZN,Lawsuit John Travoltas Son Is Allegedly Elvis Presleys Great Grandson With Riley Keough,-0.9055412623528956
2025-12-19,AMZN,Putin Backs Donald Trump S Bn Lawsuit Against The Bbc,0.546248951578862
2025-12-19,AMZN,Bondi Shooting Hate Speech Laws,-0.6541325999536454
2025-12-19,AMZN,Tax Laws Prof Yadudu Warns Against Executive Interference,0.7714856982705216
2025-12-19,AMZN,Trump Signs Executive Order Targeting State Ai Laws,0.10108506704580122
2025-12-19,AMZN,Revisiting Lawsuit Against Jack Nicklaus Over Name Image And Likeness Nil Rights,0.5727721538180195
2025-12-19,AMZN,.Thomas Skinner Withdraws Strictly Final Amid Bbc Feud,-0.7575190733606598
2025-12-19,AMZN,Quot Folding Florida Saltwater Fishing Ruler And Laws A B,0.22302178662278105
2025-12-19,AMZN,Proposed Data Center Draws Push Back In Washington Twp,0.8703842687550047
2025-12-19,AMZN,New Dc Laws Policy Measures Know About,0.8540411327467035
2025-12-19,AMZN,Texas Lawmakers From Both Parties Oppose Trumps Order Targeting State Ai Laws,-0.32822112423777416
2025-12-19,AMZN,Some Individuals Dont Want New Tax Laws To Succeed Nigerian Govt Speaks On Saboteurs,0.7503177161752619
2025-12-19,AMZN,Carb Publishes Proposed Regulations Implementing Californias Climate Disclosure Laws,0.5056668710916288
2025-12-19,AMZN,Trump Order Prompts Federal Review Of Montanas Ai Laws,0.4324021861399041
2025-12-19,AMZN,French Media Outlet Streetpress Gagged  Lawsuits Urgent Need Anti Slapp Law France,-0.9597526036439308
2025-12-19,AMZN,Perrigo Company Plc Class Action Levi  Korsinsky Reminds Perrigo Company Plc Investors Of The Pending Class Action Lawsuit With A Lead Plaintiff Deadline Of January    Prgo .Html,-0.35609064610656893
2025-12-19,AMZN,South Beach Casino Manitoba Lawsuit .,-0.8160582564146717
2025-12-19,AMZN,Red Wings Emmitt Finnie Draws Inspiration From Mom Shannon.Html,0.22181866740806155
2025-12-19,AMZN,Avicii Estate Lawsuit Dj Manager Netflix Documentary,0.29481732545413064
2025-12-19,AMZN,A Tasteless Kidnapping Joke In Dileeps New Movie Bha Bha Ba Draws Ire,0.9756288198676044
2025-12-19,AMZN,Daytime Din Or Late Night Karaoke Vietnam Draws New Lines On Noise .Htm,-0.8750075431153088
2025-12-19,AMZN,Domestic Workers Urge Laws To End Exploitation Underpayment,-0.06116373132220976
2025-12-19,AMZN,New Hampshire Joins Lawsuit Against Uber Arguing Deceptive Business Practices,-0.9326412900691095
2025-12-19,AMZN,Class Action Lawsuit Filed Against James Hardie Industries Plc Jhx R.Htm,0.3016694627269929
2025-12-19,AMZN,Menards Settles Minnesota Over  Off Rebate Lawsuit,-0.7302732474074345
2025-12-19,AMZN,Investor Alert Six Flags Entertainment Corporation Fka Coppersteel Holdco Inc Fun Investors With Substantial Losses Have Opportunity To Lead Class Action Lawsuit .Html,0.10088947989927055
2025-12-19,AMZN,Wreaths Across America Draws Edwards Troops Including Raf,0.3818863473252232
2025-12-19,AMZN,Albertas Securities Laws Updated To Reflect Evolving Capital Market,0.7724379814526865
2025-12-19,AMZN,Class Action Lawsuit Filed James Hardie Industries Plc Jhx Join R.Htm,-0.6022898082800205
2025-12-19,AMZN,Jump Trading B Lawsuit Tied To B Terra Crash,0.3250800409685055
2025-12-19,AMZN,Sylvester Stallone Why Not Return Cliffhanger Reboot Lawsuit Action,0.19560831260528388
2025-12-19,AMZN,January   Deadline Join Class Action Lawsuit Against Stride R.Htm,0.8714980165907413
2025-12-19,AMZN,Thomas Skinner Bbc Lawsuit Infuriated Bosses Extra Super Cross Damning Assessment Claim Second Woman Hes Selfishly Betrayed.Html,-0.8284418104087072
2025-12-19,AMZN,Vic Lib Leader Supports Coercive Control Laws In Victoria,-0.40264742821059185
2025-12-19,AMZN,Usd Million Kansas Oklahoma Farmland Auction Draws Strong Bidding,-0.02034894601738757
2025-12-19,AMZN,Angels Tyler Skaggs Settlement Wrongful Death Lawsuit,-0.11118460252695672
2025-12-19,AMZN,Rothenberg Addresses Lawsuit At Final Regular City Council Meeting In Northampton,-0.693979037900168
2025-12-19,AMZN,Should Belize Toughen Laws To Defend Against Attackers,-0.07302411611962056
2025-12-19,AMZN,F News  Liam Lawson Racing Bulls Seat Confirmation  Career Update Exclusive Interview,0.5933129469281311
2025-12-19,AMZN,Federal Judge Hands Down Gag Order In Ursuline Lawsuits,0.40266367151975135
2025-12-19,AMZN,Australia To Review Migration Laws After Bondi Beach Shooting,-0.14716023113837595
2025-12-19,AMZN,Berger Montague Shareholder Alert Berger Montague Reminds Telix Pharmaceuticals Ltd Tlx Investors Of Class Action Lawsuit Deadline .Htm,-0.982868598690747
2025-12-19,AMZN,Was The Year Of Online Safety Laws But Do They Work,0.8838828047544383
2025-12-19,AMZN,Steven Spielbergs Sci Fi Drama Disclosure Day Trailer Draws Bouquets And Boos,-0.04412004428955507
2025-12-19,AMZN,Why Cloudflare Aws Ai Era .Html,-0.7440145173409578
2025-12-19,AMZN,"Letter Gun Laws Did Not Prevent This Shooting,",0.18465057165807885
2025-12-19,AMZN,Primo Brands Corporation Prmb Shareholders Who Lost Money Have Opportunity To Lead Securities Fraud Lawsuit .Html,0.9244033058239924
2025-12-19,AMZN,Piers Morgan Candace Owens Brigitte Macron Lawsuit,0.2226373050627104
2025-12-19,AMZN,Madras High Court New Criminal Laws Constitutional Transformation,0.7655594534538395
2025-12-19,AMZN,Alligator Alcatraz Lawsuit Miccosukee Tribe,-0.6712990152136815
2025-12-19,AMZN,Plastic Surgeon Goes After Lawyer Behind Series Of Negligence Lawsuits,-0.7162644728160059
2025-12-19,AMZN,Teen Boy Sextortion Scheme Suicide Lawsuit Meta Levi Maciejewski.Html,0.4771396219108903
2025-12-19,AMZN,Asharq Al Awsat Publishes Outline Lebanon%E%%S Banks Deposit Repayment Plan,0.512570714390522
2025-12-19,AMZN,Nys Renewable Plan Draws Democratic Backlash,-0.22788997832779567
2025-12-19,AMZN,Nzdjpy Whipsaws After Boj Hike Buy The Dip Setup Above  With Eyes On,0.1510964996442805
2025-12-19,AMZN,Larry Ellison Retakes No Richest Spot From Jeff Bezos As Oracle Shares Rise On Tiktok Deal,0.5380161345872339
2025-12-19,AMZN,Terraform Labs Files B Lawsuit Against Jump Trading,-0.783530833238717
2025-12-19,AMZN,Mining Company Files  Millionplus Lawsuit Against Zurich After Hurricane Helene .Aspx,-0.985211140028065
2025-12-19,AMZN,How Port Arthur Reshaped Australias Gun Laws,0.6917421406109019
2025-12-19,AMZN,Biogas Plant Plan On Limerick Tipperary Border Draws Objections.Html,0.24632848885792025
2025-12-19,AMZN,Los Angeles Angels Settle Lawsuit With Family Of Pitcher Tyler Skaggs Over His Fatal Overdose,0.8343586358494026
2025-12-19,AMZN,Delay In Siddaramaiah Muda Case Report Draws Karnataka Courts Ire At Lokayukta,0.595188560085105
2025-12-19,AMZN,Inspire Medical Systems Inc Insp Shareholders Who Lost Money Have Opportunity To Lead Securities Fraud Lawsuit .Html,0.7208542631774699
2025-12-19,AMZN,Activist Wins Foia Lawsuits Against  Trinidad State Agencies,-0.6072178219688906
2025-12-19,AMZN,Larry James Spider Strawser,-0.132559620844396
2025-12-19,AMZN,Carmax Inc Kmx Lawsuit Investors Urged To Contact Levi Korsinsky R.Htm,-0.4431421006830507
2025-12-19,AMZN,Asharq Al Awsat Publishes Outline Lebanon%E%%S Deposit Repayment Plan,0.24925723578412007
2025-12-19,AMZN,Judge Tosses Trump Linked Lawsuit Targeting Chief Justice Roberts Dealing Setback Trump Allies,-0.671898736068572
2025-12-19,AMZN,Educare Schools Young Mind Expo Draws Wide Appreciation,0.25704681686527886
2025-12-19,AMZN,Government Urged To Bring In Anti Hate Laws For Everyones Protection,0.2394457754262529
2025-12-19,AMZN,Judge Mulls Steven Tyler Motion To Dismiss Accusers Lawsuit,-0.0025117025029128826
2025-12-19,AMZN,Colleton County Data Center Proposal Draws Opposition Zoning Hearing,0.21251673621718403
2025-12-19,AMZN,Visa And Mastercard Agree To $  Mln Settlement Over Atm Fee Lawsuit,-0.4673126594369097
2025-12-19,AMZN,Just In Reps Set Up Committee To Probe Alterations In Tax Laws,0.7777121660322655
2025-12-19,AMZN,Vancouver Island Grocer Settles Lawsuit After Employees Secretly Recorded In Bathroom,0.8093273880370631
2025-12-19,AMZN,Hardees Locations Closures Lawsuits B.Html,-0.3710462398820493
2025-12-19,AMZN,January   Deadline Join Class Action Lawsuit Against Perrigo R.Htm,-0.642430278693684
2025-12-19,AMZN,Public Sector Union Facing At Least Three Lawsuits From Executives It Suspended,0.4665326556719189
2025-12-19,AMZN,Inec Meets Pdp Leaders Urges Improved Compliance With Electoral Laws,0.14981382017927314
2025-12-19,AMZN,"What Would Lsquoconcealed Carry Reciprocityrsquo Mean For States With Tighter Gun Laws,",0.2882165659350082
2025-12-19,AMZN,Chipotle Lawsuit Rodents Doordash Nyc B.Html,0.44092408279278517
2025-12-19,AMZN,Keep Australians Safe Pm Pleads With Premiers On Gun Laws  Pnoxk,0.37762634480793134
2025-12-19,AMZN,Class Action Lawsuit Filed Blue Owl Capital Inc Owl Join By February R.Htm,-0.8102595201628024
2025-12-19,AMZN,Texas Lawmakers Launch Sharia Free America Caucus Aimed At Countering Islam And Sharia Laws Growing Influence In U S,0.45409960012114725
2025-12-19,AMZN,Austin Doctor Advanced Pain Care Lawsuit .Php,0.5371026399192043
2025-12-19,AMZN,Treaty Nine Lawsuit Hearings Motion To Strike .,-0.9424074021210369
2025-12-19,AMZN,Another Day Another Ev Charging Lawsuit Against The Lawless Trump Administration,-0.48435706974791026
2025-12-19,AMZN,Class Action Lawsuit Alert Levi Korsinsky Reminds Perrigo Company R.Htm,-0.37507251413549403
2025-12-19,AMZN,Antisemitism Laws To Push Constitutional Limit Says Burke  Pnoxh.Html,0.7484614428183318
2025-12-19,AMZN,Lizzo Appeals Sexual Harassment Lawsuit Claiming Its An Attack On Free Speech,-0.5204381151128867
2025-12-19,AMZN,Ace Basin Data Center Draws Ire At Zoning Appeals Meeting,-0.32412543876647004
2025-12-19,AMZN,Timothee Chalamet Esdeekid  Raws Remix,-0.7561440932880583
2025-12-19,AMZN,Coinbase Files Lawsuits In  States Over Attempts To Regulate Prediction Markets,0.055383054086598715
2025-12-19,AMZN,Captiva Restaurant Files Lawsuit Over Sand Dune Blocking Sunset Views Seeks  M,0.8479803971223405
2025-12-19,AMZN,Kmx Lawsuit Alert Levi Korsinsky Notifies Carmax Inc Investors R.Htm,0.39089339626709685
2025-12-19,AMZN,Class Action Lawsuit Filed Against Stride Inc Lrn Recover Losses R.Htm,0.017511982536013937
2025-12-19,AMZN,Sylvester Stallone Cliffhanger Reboot Pay Dispute Lawsuit,0.23978916110921134
2025-12-19,AMZN,Nc County Settles Lawsuit Over Stifling Public Comment,-0.7799532316636248
2025-12-19,AMZN,Professor Law Associate Professor Law And Assistant Professor Lawsociology Political Science Vacancy At National Law University Delhi,-0.10236064698576941
2025-12-19,AMZN,Mafs Uk Fans Jaws Drop,-0.3961968550331114
2025-12-19,AMZN,Stricter Gun Laws Are Coming To Nsw Here S What Is Changing  Pnps.Html,-0.145876037567521
2025-12-19,AMZN,Securities Class Action Lawsuit Filed Against Defi Technologies Deft R.Htm,-0.2209655477260235
2025-12-19,AMZN,Sylvester Stallone Cliffhanger Reboot Neal Moritz Lawsuit,0.07005422962009167
2025-12-19,AMZN,Punjab Govt Prepares Strict Laws Against Land Mafia Property Fraud,-0.17340945032425137
2025-12-19,AMZN,After Bondi Beach Massacre Australias Gun Laws Under Focus,-0.9062415506543253
2025-12-19,AMZN,Lawsuit Over Californias Ban On Non Lethal Self Defense Weapons,-0.14865028638757338
2025-12-19,AMZN,New Lawsuit Filed Over Stardust Racers Roller Coaster Epic Universe,-0.8989026167135448
2025-12-19,AMZN,Aat Least We Will Have A Peaceful Christmasa Say Livhuas In Laws,-0.5163960714730489
2025-12-19,AMZN,Mark Nussbaums Ex Partner Faces New Lawsuit,-0.09791391101052582
2025-12-19,AMZN,Nadia Afgan Slams Punjab Government For Ignoring Stray Dog And Tree Protection Laws,0.8481301081844075
2025-12-19,AMZN,Mi Legislature Wraps Up  On Track Toward A Record Low Number Of New Laws,-0.23963070770438222
2025-12-19,AMZN,Historic Lawsuit Exposes Pentagons Forced Vaccination Program.Html,0.9006723098726612
2025-12-19,AMZN,Doj Targets Georgia In New Voter Registration Lawsuit Tennessee Moves Toward Compliance,0.4011376679477956
2025-12-19,AMZN,Gigawatt Data Center Proposal Draws .Html,-0.5437818983613123
2025-12-19,AMZN,As Budgets Tighten Rutherford County Sees Rise In Debt Lawsuits,-0.6320553833232099
2025-12-19,AMZN,What Hellofreshs Accc Lawsuit Reveals About Digital Commerce In Australia,-0.6876982167408598
2025-12-19,AMZN,Elon Musks Inappropriate Comment On Sydney Sweeneys Body Draws Severe Criticism On Social Media,-0.6947995326707121
2025-12-19,AMZN,New Laws California,0.18730196918736697
