date,entity,title,sentiment_score
2025-12-19,GOOGL,Sam Altman Calls Google A Huge Threat Says The Tech Giant Would Have Been Able To Smash Openai In,-0.37612741076833167
2025-12-19,GOOGL,Google Cloud Lands Deal With Palo Alto Networks Approaching  Billion Per Source Ceddddcafe,-0.24367849228578353
2025-12-19,GOOGL,Youtubers Livestream Featured On White House Website Without Explanation.Html,-0.4292001253712687
2025-12-19,GOOGL,Google Pixel Launcher Update Replaces Search Bar Ignites User Backlash,-0.8391999647261079
2025-12-19,GOOGL,Ai Outlook  Tech Stocks Telsa Robotaxis Google Apple Nebius,0.7920221556592464
2025-12-19,GOOGL,Youtube Boots Two Channels For Posting Fake Ai Film Trailers,-0.8339661942244183
2025-12-19,GOOGL,Rep Gilbert Ray Cisneros Jr Sells Off Shares Of Alphabet Inc Nasdaqgoogl.Html,0.3935167891121847
2025-12-19,GOOGL,Google Pixel Android Car Bluetooth Audio Bug,0.5633017622420553
2025-12-19,GOOGL,Pa Supreme Court Rules That Police Can Access Google Searches Without A Warrant,-0.546912843109421
2025-12-19,GOOGL,One Best Shows Year Just Spoiled Google Earth,-0.2728114973926161
2025-12-19,GOOGL,Youtube Down For Thousands Of Us Users Downdetector Shows,0.5346079132620185
2025-12-19,GOOGL,Former Nascar Driver Greg Biffle Was Reportedly Flying Famous Youtuber When Plane Crash Happened,0.4249501261537254
2025-12-19,GOOGL,Google Launches Pixel Upgrade Program In India Offering Annual Upgrades From Rs  Per Month,0.0392360656142845
2025-12-19,GOOGL,Social Skinny Academy Awards Moving Youtube Ftcs Instacart Probe Amazons Ai Chief Departs,-0.6970352032963041
2025-12-19,GOOGL,Exclusive Inside Googles Plan To Make Ai Tools Accessible To Small Businesses Worldwide.Html,-0.08162930986094641
2025-12-19,GOOGL,Selena Gomez Justin Bieber Relationship Uncoupled Youtube Show.Html,0.6104620258631743
2025-12-19,GOOGL,Fans Celebrate After Google Kills  Of The Biggest Fake Movie Trailer Channels On Youtube,-0.9473088192166017
2025-12-19,GOOGL,Oscars Youtube Analysis Good Or Bad,-0.41382897759227943
2025-12-19,GOOGL,Google Cloud Lands Deal Palo .Html,-0.3479038019010783
2025-12-19,GOOGL,Youtube Down For Thousands Of Us Users Downdetector Shows Ceddddcf,0.15326222716719884
2025-12-19,GOOGL,Oscars Telecast To Move Off Broadcast Tv To Youtube In,0.7095602477181653
2025-12-19,GOOGL,How Black American Culture Dominated Googles  Search Bar,-0.6602926966245397
2025-12-19,GOOGL,Google Deepens Consumer Credit Push In India With Upi Linked Card,-0.22224226339391318
2025-12-19,GOOGL,Northside Capital Management Llc Sells  Shares Of Alphabet Inc Goog.Html,-0.8161777454905421
2025-12-19,GOOGL,Misreading Google Trends Fueling Bondi Attack Conspiracies,0.37935309951217344
2025-12-19,GOOGL,Pennsylvania Supreme Court Permits Warrantless Google Search Access,0.983501861311886
2025-12-19,GOOGL,Youtube Gone Down Thousands Outages .Html,-0.5638905944384873
2025-12-19,GOOGL,Google Launches Gemini  Flash The Ai As Fast As A Simple Google Search,-0.5389644905802808
2025-12-19,GOOGL,Alphabet Nasdaqgoogl Given New   Price Target At Citigroup.Html,-0.4081989779023516
2025-12-19,GOOGL,White House Website Youtube Livestream A,0.34258194689682653
2025-12-19,GOOGL,Google Searches Not Private Pa Court Effectively Rules,0.7061777374364684
2025-12-19,GOOGL,Tuya Ces  Tuya Developer Day Set To Kick Off Featuring Industry Heavyweights From Google Cl Ceddddbff,0.4665855377367851
2025-12-19,GOOGL,Youtube Down For Thousands Of Users Downdetector Shows,-0.72514955922984
2025-12-19,GOOGL,Google News App Rolls Out Listen Feature To Read Headlines Aloud Handsfree .Html,0.18347942101026904
2025-12-19,GOOGL,Reasons Youtube Premium Is Worth The Monthly Fee,0.9770335203444818
2025-12-19,GOOGL,Google Introduces Cc Experimental Ai Agent Personalised Briefings,-0.8471438004987644
2025-12-19,GOOGL,Google To Loosen Pharma Ad Rules For Admob Authorized Buyers,-0.39234921665870726
2025-12-19,GOOGL,Spanish Consumer Group Sue Google.Html,0.6304266312427238
2025-12-19,GOOGL,Heres Why The Oscars Streaming On Youtube Is A Good Thing,0.12157802077580948
2025-12-19,GOOGL,University Develops Ai Training Ground Googlecloud,0.3887850360989018
2025-12-19,GOOGL,Alphabet Nasdaqgoogl Price Target Raised To  .Html,-0.9482603174607307
2025-12-19,GOOGL,Google Algorithm Insights,-0.06601829581787988
2025-12-19,GOOGL,Youtube Google Not Working Users Across India Us Hit By Major Outage Ws L .Html,0.5488903330467942
2025-12-19,GOOGL,Google Sues Serpapi Over Search Scraping And Dmca Violations,0.6929088513620121
2025-12-19,GOOGL,Google Pixel Smartphones Get Second December Update With Battery Drain Fixes And Touch Improvements Article .Html,0.09297728879331779
2025-12-19,GOOGL,The Oscars Is Heading To Youtube,-0.7069071133874019
2025-12-19,GOOGL,White House Website Youtube Finance Livestream Mystery Qplsyde,-0.6711206305449535
2025-12-19,GOOGL,White House Investigating After A Youtube Livestream Popped Up On Its Website,0.4691612115499839
2025-12-19,GOOGL,Google Backed Cloud Wins Frances Strongest Sovereignty Certification,-0.07568208411727029
2025-12-19,GOOGL,Youtubes Ai Trailer Purge Disney Complaint Ends Era Of Fake Hits,-0.34501884947543937
2025-12-19,GOOGL,Sam Altman Says Openai Expects More Code Red As Ai Race With Google Anthropic And Others Heats Up.Html,-0.4317606013178821
2025-12-19,GOOGL,Youtube Outage Briefly Blocks Users Worldwide Service Now Largely Back Online,-0.8363487502880693
2025-12-19,GOOGL,Google Sans Flex Goes Open Source The Evolution Of Googles Signature Typeface,-0.3230119513715288
2025-12-19,GOOGL,Google Wants You To Upgrade Your Pixel Every Year For Just Rs   A Month Article .Html,-0.9332669040169972
2025-12-19,GOOGL,Google Launches Pixel Upgrade Program In India With Annual Upgrades Starting At Rs  Per Month Article .Html,-0.33328058022978646
2025-12-19,GOOGL,Google Introduces Pixel Upgrade Program For India With No Cost Emi Exchange Bonus And More,-0.7388201233011338
2025-12-19,GOOGL,The Oscars Are Moving To Youtube In,-0.8804381049861607
2025-12-19,GOOGL,Oscars Youtube Big Story Podcast,-0.005314332915353992
2025-12-19,GOOGL,Global Youtube Outage Disrupts Service For Thousands,0.08016445106274794
2025-12-19,GOOGL,Epstein Latest Photos Go Viral Microsofts Bill Gates Seen With Several Girls Googles Sergey Brin Visited Estate As Well,-0.5226412187780534
2025-12-19,GOOGL,Was The White House Hacked Youtubers Livestream Appears On Official Website.Html,0.7664956314555018
2025-12-19,GOOGL,Ongoing Youtube Google Outage Reported Outage Spikes Across Popular Services,-0.34284023100349525
2025-12-18,AAPL,Kyivstar Enables Starlink Direct To Mobile Testing On Iphone For Sms In Remote Areas,0.36650416016509024
2025-12-18,AAPL,Apple Opens Iphone Alternative App .Html,-0.5101540625344445
2025-12-18,AAPL,Apple Discusses Iphone Chip Assembly With Indian Manufacturers,0.7802695798229169
2025-12-18,AAPL,Best Free Attraction In Usa According To Tripadvisor,0.3935347668962963
2025-12-18,AAPL,.Childhood Books Gave Us Escapism Ipads,0.15885744052598327
2025-12-18,AAPL,Samsung Eyes Variable Aperture Revival To Challenge Iphone  Pro,-0.5119301089405555
2025-12-18,AAPL,First Photo Iphone Fold Leaked Apples New Phone Price Revealed,0.244902006079891
2025-12-18,AAPL,Flagships From China Threaten To Overshadow Iphone  Galaxy S .Html,0.6407693368016638
2025-12-18,AAPL,Q  Global Chipset Market Share A And A Pro Shipments Help Apple Increase Its Hold,-0.31711250692617576
2025-12-18,AAPL,Kim Mulkey Joins Miracle Children S Foundation To Donate Ipads To Olol Children S Hospital,0.9874636873257323
2025-12-18,AAPL,Apple Japan Iphone Alternative App Stores,-0.5704214944720905
2025-12-18,AAPL,Apple Supply Chain Osat Iphone Packaging.Html,-0.39008834691219674
2025-12-18,AAPL,Apple Begins Exploring Iphone Chip Packaging In India For The First Time.Html,0.01440135334458481
2025-12-18,AAPL,Apple Opens Iphone To Alternative App Stores In Japan Under New Competition Law,-0.276525691551436
2025-12-18,AAPL,Lg Innotek Under Screen Camera Has Properties Ideal For Beze Less Iphone,0.344909152642362
2025-12-18,AAPL,Apple S First Foldable Iphone Rumoured To Launch Next Year What To Expect Article .Html,-0.9644401890278116
2025-12-18,AAPL,A Truly Forever Case For The Iphone Is Here,0.3382836345326714
2025-12-18,AAPL,Niddhi Agerwal Mobbed Hyderabad During Raja Saab Event Chinmayi Sripada Responds,-0.8178463171286481
2025-12-18,AAPL,Foldable Iphone Leaks,0.9156039774278681
2025-12-18,AAPL,Attempt To Smuggle  Gold Bars And  Iphones Foiled At Vietnam Airport .Html,0.634462535184783
2025-12-18,AAPL,Apple Announces Sweeping App Store And Iphone Changes In Japan,0.8502312935469676
2025-12-18,AAPL,Texas Permanent School Fund Corp Acquires  Shares Of Tripadvisor Inc Trip.Html,-0.2534772537600154
2025-12-18,AAPL,Morgan Stanley Lifts Apple Target To  Amid Iphone Ai Growth,0.06210388577506909
2025-12-18,AAPL,Apple Opens Up Iphone To Alternative App Stores And Browser Engines In Japan,0.4810064634097604
2025-12-18,AAPL,Apple Inc Aapl Stock Position Reduced By Bank Of New Hampshire.Html,0.5425045900977128
2025-12-18,AAPL,Harmful For India Armed Forces Shripad Naik On Prithviraj Chavans Op Sindoor Comment Ws L .Html,0.34842824799973204
2025-12-18,AAPL,Mami Launches Third Edition Of Filmed On Iphone With Renowned Filmmakers As Mentors Article .Html,0.7115494550047166
2025-12-18,AAPL,Heres Why You May Have To Wait Until  To Get An Iphone Fold,-0.9282206796044243
2025-12-18,AAPL,Apples Slim Iphone Air Challenges Android Dominance In,-0.25402562676026386
2025-12-18,AAPL,Apple Opens Iphone To Alternative App Stores In Japan Ceddfdfffc,0.41230671835641597
2025-12-18,AAPL,Indias Defence Production Reaches All Time High Fy Shripad Naik,0.7465885899381628
2025-12-18,AAPL,Apple Iphone  Pro,-0.5437107239859236
2025-12-18,AAPL,Apple Introduces Iphone To Alternate App Stores,0.22840000083098677
2025-12-18,AAPL,Apple Opens Iphone To Alternative App Stores In Japan,-0.16014172289367457
2025-12-18,AAPL,Rep Gilbert Ray Cisneros Jr Buys Apple Inc Nasdaqaapl Shares.Html,0.7414701191111785
2025-12-18,AMZN,Snps Lawsuit Synopsys Inc Sued For Securities Fraud After  Stock R.Htm,0.216186357923555
2025-12-18,AMZN,Islamic Council Raises Alarm Over Secret Alterations Nigerias Gazetted Tax Laws Demands,0.008696981120514646
2025-12-18,AMZN,China Covid  Origin Lawsuit Missouri B.Html,-0.5284962680322014
2025-12-18,AMZN,Homelessness Lawsuit Closes With Residents Receiving Hotel Shelter,-0.2170833782160675
2025-12-18,AMZN,.Australia Announces Tougher Hate Speech Laws Wake Bondi Terrorist Attack,0.8579572018253703
2025-12-18,AMZN,Helicopter Jet Collision Lawsuit,-0.7941042261749962
2025-12-18,AMZN,Mourners Grieve  Year Old Slain In Bondi Mass Shooting As Australia S Leader Pledges New Hate Laws,-0.3596111462055005
2025-12-18,AMZN,Evil Anti Semitism Targeted With Tougher Hate Laws,-0.16730379537074858
2025-12-18,AMZN,Mourners Grieve  Year Old Slain In Bondi Mass Shooting As Australias Leader Pledges New Hate Laws,-0.45370549318501197
2025-12-18,AMZN,Who Navarone Garibaldi Garcia Priscilla Presley S Son Named Defendant Lawsuit Alleging John Travolta Fathered Baby Riley Keough,-0.7564631568271702
2025-12-18,AMZN,Australia To Introduce Laws To Crack Down On Hate Speech After Bondi Shooting,-0.6257056959793896
2025-12-18,AMZN,Julian Assange Sweden Broke Own Laws With Nobel Prize To Ven,0.154807428560509
2025-12-18,AMZN,Kmx Lawsuit Carmax Inc Sued For Securities Fraud After  Stock R.Htm,-0.7675233640562307
2025-12-18,AMZN,Australia Announces Tougher Hate Speech Laws In Wake Of Bondi Terrorist Attack,0.44356142820208544
2025-12-18,AMZN,Top Stock Picks Defense Biotech Investing Ideas Ubs Amzn Pep,-0.7418170254720955
2025-12-18,AMZN,Dawson Creek Extends Warming Centre Operation As Cold Snap Continues,0.6782474436578632
2025-12-18,AMZN,Sf Mayor Reflects Year Draws Close,0.840249913183053
2025-12-18,AMZN,Oklahoma Joins Uber Lawsuit Against Uber One,0.8917850316317169
2025-12-18,AMZN,Tenney Urges Review Of Spain Boycott Laws,-0.1065351528920544
2025-12-18,AMZN,China Android Turf War Draws Regulatory Attention,0.4116279258469999
2025-12-18,AMZN,Open Navigation And Laws Demonstrate Capabilities Of Nav And Laws Supervisor Integration,-0.8000435195380629
2025-12-18,AMZN,Securities Class Action Lawsuit Filed Against Synopsys Inc Snps R.Htm,0.7074831230900849
2025-12-18,AMZN,Lucasfilm Wins Bid To Throw Out Uk Lawsuit Over Resurrection Of Star Wars Character,0.4765573501704252
2025-12-18,AMZN,Hr Giant Shrm Faces New Discrimination Lawsuit,0.9501864793037547
2025-12-18,AMZN,Paws And Claws Puerto Vallarta Reflects On A Year Of Giving,-0.5918015458874781
2025-12-18,AMZN,State Seeks Dismissal Of Lawsuit In Johnson County Over Mandated Supervisor Districts,-0.6676017743077327
2025-12-18,AMZN,Lauren Sanchez Jeff Bezos Brooks Nader Girls Night.Html,-0.9010569133073998
2025-12-18,AMZN,Class Action Lawsuit Filed Against James Hardie Industries Plc Jhx R.Htm,0.8680026901909184
2025-12-18,AMZN,Menards Rebate Lawsuit Settlement,-0.24775272677598692
2025-12-18,AMZN,Janes Addiction Truce Perry Farrell Blowup Lawsuits,0.5673729951507815
2025-12-18,AMZN,Light Of Motiram Horizon Zero Dawn Sony Tencent Lawsuit Settled,0.851391705005361
2025-12-18,AMZN,City Forges Ahead With High Rise Despite Granite Clubs Lawsuit Threat,0.4130691115138714
2025-12-18,AMZN,Fallout Season  Deathclaws Jonathan Nolan,-0.5835788546182212
2025-12-18,AMZN,Year Old Killed Bondi Mass Shooting Hate Laws,0.2908092552735979
2025-12-18,AMZN,Adobe Faces Class Action Lawsuit Over Alleged Ai Training On Pirated Works Article .Html,0.5333699047350196
2025-12-18,AMZN,Aws Ceo Replacing Junior Developers With Ai Is Catastrophic Mistake,-0.19863432600758268
2025-12-18,AMZN,Will Congress Allow One Of The Nations Critical Cybersecurity Laws To Lapse,0.6802956110459792
2025-12-18,AMZN,C Vinyl Release Bose Nme Dawsons Where Location London,0.12084431029465037
2025-12-18,AMZN,How New Tax Laws Affect Nigerians,-0.11235112990948748
2025-12-18,AMZN,Menards Lawsuit Settlement,-0.3523341779512845
2025-12-18,AMZN,Riley Keough Is Biological Mom Of John Travoltas Son Lawsuit Claims,0.6977633574729118
2025-12-18,AMZN,Mourners Grieve  Year Old Slain In Bondi Mass Shooting As Australias Leader Pledges New Hate Laws Ab,-0.45006710205809064
2025-12-18,AMZN,Dxcm Lawsuit Alert Levi Korsinsky Notifies Dexcom Inc Investors R.Htm,0.9308496229426104
2025-12-18,AMZN,Snow Plow Driving Laws Massachusetts,-0.34744191434885385
2025-12-18,AMZN,Interview Pawspeople Opens Submissions Th Annual Dog Year Contest,-0.7123835776822529
2025-12-18,AMZN,Affinity Partners Withdraws Interest In Warner Bros Takeover Deal,-0.4322052246694168
2025-12-18,AMZN,No Data No Oversight Florida Bear Hunt Draws Criticism From Conservation Group,-0.47309972536114686
2025-12-18,AMZN,Tougher Anti Smuggling Laws Key,-0.48228779206210426
2025-12-18,AMZN,Christchurch Ai Platform Caitlyn Shines At Aws Re Invent,-0.03152824893920214
2025-12-18,AMZN,Snps Lawsuit Alert Levi Korsinsky Notifies Synopsys Inc Investors R.Htm,-0.8048874965634059
2025-12-18,AMZN,Albanese Announces New Laws Cracking Down On Hate Speech And Preachers Of Hate After Bondi Beach Attack Ntwnfb,-0.6818854576625555
2025-12-18,AMZN,Campbell Rivers Rivercity Players Holding Open Auditions For Shawshank Redemption,0.8529123436907984
2025-12-18,AMZN,Umes President Lawsuit Plagiarism Defamation,-0.5887922006234665
2025-12-18,AMZN,F News  Liam Lawson Interview Summer Grill Racing Bulls Red Bull New Zealand,-0.3533327405752693
2025-12-18,AMZN,Parl Panel Flags Lapses In Enforcement Of Laws To Protect Women Workers .Html,-0.18494787140434377
2025-12-18,AMZN,Lawsuit Argues Rock Chalk Crackdown.Html,-0.24242296805350216
2025-12-18,AMZN,Fedex Warehouse Worker Lawsuit,0.5629914706349957
2025-12-18,AMZN,Judiciary Offices Records Trump Lawsuit,0.17432247769663856
2025-12-18,AMZN,Lawsuit Seeks Protection For Critically Imperiled Virginia Millipede,0.2350123483318045
2025-12-18,AMZN,Australia Announces Tougher Hate Speech Laws In Wake Of Bondi Terror Attack,-0.9885798939320856
2025-12-18,AMZN,Judge Affirms Metas Dismissal In Uvalde Shooting Families Lawsuit,-0.6441614531957498
2025-12-18,AMZN,Lawsuit Aims To Block Californias New K  Antisemitism Law,0.843385440622519
2025-12-18,AMZN,American Airlines Pilots Lawsuit Discrimination,0.23617275451385056
2025-12-18,AMZN,Rainbow Draws Its So Important To Stay Curious About The Diversity Of This World,0.32560985493273154
2025-12-18,AMZN,.Romsey Makers Christmas Market Draws Crowds,0.951329861367834
2025-12-18,AMZN,Punjab Notifies Unified Building Bylaws Stilt Plus Four Floors Allowed In All New Residential Areas,-0.8846922291002055
2025-12-18,AMZN,Riley Keough And John Travoltas Relationship Explained Amid Lawsuit,-0.48248062530182323
2025-12-18,AMZN,Walmart Pepsico Face Price Fixing Lawsuit,-0.10867674529667504
2025-12-18,AMZN,Federal Funding Freeze Threatens Oregons New Ev Charging Network As State Joins Lawsuit To Force Release Of Money,-0.18247091026374385
2025-12-18,AMZN,Intl Gifts Housewares Expo Draws Over  Enterprises Post.Vnp,0.6320124026572933
2025-12-18,AMZN,Monarch Air Group Files Lawsuit Against Blade Urban Air Mobility And Trinity Air Medical,0.3529113134866684
2025-12-18,AMZN,Pa Joins Lawsuit Against Uber,-0.6773521567613858
2025-12-18,AMZN,Religious Charter Schools Lawsuit Attorney General Skrmetti Opinion,0.04899305279536903
2025-12-18,AMZN,Ventura Highlights Conservation Laws Taking Effect Jan,-0.040957337879719
2025-12-18,AMZN,Bgold Btg Draws Analyst Interest .Html,-0.6456174211702419
2025-12-18,AMZN,Banks Win Bid To Block   Billion Mass Forex Uk Lawsuit Ceddcdbfd,-0.24841293024376165
2025-12-18,AMZN,New Tax Laws Impeachable Offence Nigerians React As Lawmaker Dasuki Alleges Alteration,-0.49354870220378966
2025-12-18,AMZN,Securities Lawsuit Alert Carmax Inc Kmx Contact Levi Korsinsky R.Htm,0.04732787684212858
2025-12-18,AMZN,Odisha Draws Over Rs  Crore In Investment Intent On Day  Of Hyderabad Meet,-0.32422148283517416
2025-12-18,AMZN,Minnesota Workplace Break Laws,-0.005063006652809676
2025-12-18,AMZN,Lrn Lawsuit Stride Inc Sued For Securities Fraud After  Stock R.Htm,0.9715191142964115
2025-12-18,AMZN,Wisconsin Dairy Farm Lawsuit Eeoc Discrimination Sexual Harassment,0.030626492593330834
2025-12-18,AMZN,Elvis Presleys Heir Revealed To Be John Travoltas Son After Riley Keough Donated Eggs Lawsuit Claims,0.29989055766588035
2025-12-18,AMZN,Nintendo Wins M In  Year Old Lawsuit Over Wii Controller Patent,0.7844659249332007
2025-12-18,AMZN,Orland Park Lawsuit Former Mayor Keith Pekau,0.16967728263655735
2025-12-18,AMZN,Old Labour Laws Belong To History New Labour Codes To The Future Supreme Court Justice Manmohan,0.32376097727707864
2025-12-18,AMZN,John Travolta Son Riley Keough Biological Mom Lawsuit.Html,-0.10350072377205577
2025-12-18,AMZN,Bondi Beach Shooting Australia Laws Hate Speech Victims,0.7810709025392153
2025-12-18,AMZN,Bcer First Nations And Others Ask Questions Of Dawson Creeks Peace River Pipeline Plan Amid Water Supply Crisis,-0.8025819869181239
2025-12-18,AMZN,How Jeff Bezos Uses The Washington Post To Promote Inequality,0.595508414351388
2025-12-18,AMZN,China Sues After Missouri Seeks To Collect On  Billion Court Judgement Prosecutor Says Associated Press Wuhan Covid Pandemic Lawsuit,0.9609431517331131
2025-12-18,AMZN,Uk Police Arrest Pro Palestine Activists Over Calling For Intifada Under Speech Laws,-0.04647543908891927
2025-12-18,AMZN,More Rainfall Expected Over Festive Seasonsaws,-0.5993738582514248
2025-12-18,AMZN,Celebration Bowl Draws   Million Viewers On Abc,0.37859473707399904
2025-12-18,AMZN,Snps Investors Have Opportunity To Lead Synopsys Inc Securities Fraud Lawsuit .Html,-0.2199055042376299
2025-12-18,AMZN,Jurors Wrap Up Another Day Of Deliberations In Skaggs Lawsuit Trial,-0.050155122969772314
2025-12-18,AMZN,Lrn Investor Alert Stride Inc Investors With Substantial Losses Have Opportunity To Lead Investor Class Action Lawsuit .Html,0.3649991174912395
2025-12-18,AMZN,Reps Set Up Committee To Probe Altered Tax Laws,-0.22317572203195968
2025-12-18,AMZN,Berger Montague James Hardie Industries Plc Jhx Deadline Approaching Berger Montague Advises Investors Of Deadline In Securities Fraud Lawsuit .Htm,0.7056542994672068
2025-12-18,AMZN,Tax Laws Altered,-0.8796388351630822
2025-12-18,AMZN,Photos Riley Keough Allegedly Named Biological Mother John Travoltas Youngest Son Lawsuit,0.03650232669578335
2025-12-18,AMZN,Ag Nessel Joins Lawsuit Against Uber Over Deceptive Billing Practices,-0.5097113117965228
2025-12-18,AMZN,License Plate Laws Texas,-0.8648965786044533
2025-12-18,AMZN,Lawsuit Sextortion On Mark Zuckerbergs Instagram Led To Suicide Of  Teenage Boys,0.569105122382803
2025-12-18,AMZN,Berger Montague Class Action Reminder Berger Montague Advises Six Flags Entertainment Corp Fun Investors To Inquire About A Securities Fraud Laws .Htm,-0.8401414732998931
2025-12-18,AMZN,Simon Cowells New Boy Band Possible Lawsuit Looms December  Shortly After Launch,-0.44954572034417684
2025-12-18,AMZN,Sony And Tencent Reach Confidential Settlement Over Horizon Clone Light Of Motiram Effectively Ending The Lawsuit,0.4365223944515224
2025-12-18,AMZN,Berger Montague Stride Inc Securities Fraud Notice Berger Montague Informs Stride Inc Lrn Investors Of A Securities Fraud Lawsuit .Htm,0.154269327134672
2025-12-18,AMZN,Class Action Lawsuit Filed Against Freeport Mcmoran Inc Fcx Recover R.Htm,0.03071389923330825
2025-12-18,AMZN,Minimum Wage Laws,-0.1592079309263803
2025-12-18,AMZN,Kmx Deadline Kmx Investors Have Opportunity To Lead Carmax Inc Securities Fraud Lawsuit Filed By The Rosen Law Firm .Html,-0.27265078957236355
2025-12-18,AMZN,Proposed Change To Nra Bylaws Raises Concerns About Member Rights And Law,-0.2273342615112106
2025-12-18,AMZN,Judge Throws Out Vermonts Lawsuit Against Facial Recognition Software Firm Clearview Ai,0.831988415912911
2025-12-18,AMZN,Liberians Call For Stronger Laws Security Reforms,-0.07728483950813847
2025-12-18,AMZN,New Police Service Dogs Pawsitively Proud To Serve Lower Mainalnd,-0.747212262479136
2025-12-18,AMZN,My New Project Draws Inspiration From Black Sherif Northern Roots,-0.9205825054787147
2025-12-18,AMZN,Reps Set Up Panel To Probe Discrepancies In Gazetted Tax Laws,0.7783653894685503
2025-12-18,AMZN,January   Deadline Join Class Action Lawsuit Against Telix Pharmaceuticals R.Htm,-0.7610407706890732
2025-12-18,AMZN,Small Town Christmas Magic Draws Visitors Newberrys Holiday Celebration,-0.7029654187472321
2025-12-18,AMZN,From The Kia Boys To Kia Lawsuits How Democrats Got Crime Backward,0.5025250278292552
2025-12-18,AMZN,Nintendo Wii Lawsuit,-0.739610289813105
2025-12-18,AMZN,Jeff Bezos Lauren Sanchez Donate  Million To Neurodiversity Educator What We Know About The Award Mackenzie Scott .Html,-0.977702118585628
2025-12-18,AMZN,New Delaware Laws Taking Effect Jan,-0.3456719990743189
2025-12-18,AMZN,Itgr Lawsuit Integer Holdings Corporation Sued For Securities Fraud R.Htm,-0.2655610777918307
2025-12-18,AMZN,American Airlines Accused Of Racial Discrimination In Lawsuit Filed By Former Pilot Students,-0.8855440498350053
2025-12-18,AMZN,Iim Event Draws  Research Submissions From  Countries,0.20585480334474449
2025-12-18,AMZN,Vancouver Island Grocer Settles Lawsuit After Employees Secretly Recorded In Bathroom,0.5001566103408694
2025-12-18,AMZN,President Trump Issues Executive Order Curbing Onerous State Ai Laws,0.5027618184317926
2025-12-18,AMZN,Australian Prime Minister Calls For Stricter Hate Speech Gun Laws,0.7247678895851597
2025-12-18,AMZN,Jhx Lawsuit Alert Levi Korsinsky Notifies James Hardie Industries R.Htm,0.6714608352378959
2025-12-18,AMZN,.Trump Files Lawsuit Bbc   Billion Damages,0.5054735922731579
2025-12-18,AMZN,Prince Harry Draws Warm Fan Reaction After Aspen Polo Photos Surface,0.12074456445471182
2025-12-18,AMZN,Court Axes Trevor Milton Lawsuit Awards Attorneys Fees Cnbc And Hindenburg,0.7190766771769999
2025-12-18,AMZN,Maui Police Chief John Pelletier Seeks Apology As Diddy Civil Lawsuit Is Dismissed,-0.5144776171203547
2025-12-18,AMZN,Could Have Done More Pm Announces New Antisemitism Laws  Pnom,-0.19444318626314305
2025-12-18,AMZN,Eco Friendly Plates Straws Contaminate Gluten.Html,-0.159665637157145
2025-12-18,AMZN,Weinstein Pal Jeff Bezos Silent Allegations Rape,0.4041072739615821
2025-12-18,AMZN,Electric Vehicle Charging Stations Programs Stall As Federal Funding Is In Question Projects Congress Trump Administration Lawsuit Businesses Gas Stations Money Clean Drive Indiana Michigan,-0.7979850207866803
2025-12-18,AMZN,Extradition Laws In Ghana A Comprehensive Overview Into Its Framework Principles And Practice,-0.40885476388125985
2025-12-18,AMZN,Former Bungie Directors Lawsuit Against Bungie And Sony Dismissed For Lack Of Jurisdiction Over Monetary Damages,0.6375620119639849
2025-12-18,AMZN,So Now Australias Gun Laws Are Riddled With Loopholes N,0.4066258436189769
2025-12-18,AMZN,Sony And Tencent Settle Lawsuit Over Slavish Clone Of Horizon Zero Dawn,-0.5705581436678178
2025-12-18,AMZN,Exclusive Aws Outlines Agentic Ai Strategy For Enterprises,-0.21688274677734176
2025-12-18,AMZN,Sonoma County Sheriffs Deputy Discrimination Lawsuit,-0.5621692213922223
2025-12-18,AMZN,Roblox Faces Iowa Lawsuit Alleging Risks To Child Users,0.5554061910771018
2025-12-18,AMZN,New Hampshire Lawsuit Uber,-0.6975726042241448
2025-12-18,AMZN,Menards Settles Deceptive  Rebate Lawsuit For  M With  States,-0.3115119813091718
2025-12-18,AMZN,Monarch Air Group Llc Monarch Air Group Files Lawsuit Against Blade Urban Air Mobility And Trinity Air Medical .Htm,-0.4531172463346236
2025-12-18,AMZN,Match Tinder Hinge Lawsuit Stephen Matthews,-0.6383570665153426
2025-12-18,AMZN,A Mourners Grieve  Year Old Slain In Bondi Mass Shooting As Australias Leader Pledges New Hate Laws,-0.5950088721626745
2025-12-18,AMZN,Wuhan Sues Missouri Retaliation Coronavirus Lawsuit,0.7618343430715215
2025-12-18,AMZN,Wwe K Caws,-0.30548830636618063
